ProjectID,file,ID,text,functional,Function,Behavior,Data,OnlyF,F,OnlyQ,Q,UserRelated
eTour,UC49.txt,UC49.txt.description,View the list of personal favorites,1,1,1,1,1,1,0,0,0
eTour,UC49.txt,UC49.txt.flow_of_events.0,Select the feature to display the list of personal favorites,1,1,0,1,1,1,0,0,1
eTour,UC49.txt,UC49.txt.flow_of_events.1,Upload the list of bookmarks,1,1,1,1,1,1,0,0,0
eTour,UC49.txt,UC49.txt.name,View Preferred Site,1,1,1,1,1,1,0,0,0
eTour,UC49.txt,UC49.txt.postcondition,The system displays the list of bookmarks Interruption of the connection to the server ETOUR,1,0,1,0,1,1,0,0,0
eTour,UC49.txt,UC49.txt.precondition,The Tourist has successfully authenticated to the system,0,0,0,0,0,0,0,0,1
eTour,UC50.txt,UC50.txt.actor,initialized by Tourist,0,0,0,0,0,0,0,0,1
eTour,UC50.txt,UC50.txt.description,View the list of sites for which it has issued a feedback,1,1,1,1,1,1,0,0,1
eTour,UC50.txt,UC50.txt.flow_of_events.0,Select the feature to display the list of sites visited personal,1,1,0,1,1,1,0,0,1
eTour,UC50.txt,UC50.txt.flow_of_events.1,Upload the list of sites for which the tourist has issued a Feedback,1,1,1,1,1,1,0,0,0
eTour,UC50.txt,UC50.txt.name,View Visited Sites,1,1,1,1,1,1,0,0,0
eTour,UC50.txt,UC50.txt.postcondition,The system displays a list of sites visited Interruption of the connection to the server ETOUR,1,0,1,0,1,1,0,0,0
eTour,UC50.txt,UC50.txt.precondition,Tourist has successfully authenticated to the system,0,0,0,0,0,0,0,0,1
eTour,UC51.txt,UC51.txt.actor,initialized by Tourist,0,0,0,0,0,0,0,0,1
eTour,UC51.txt,UC51.txt.description,Inserts a site selected in the list of bookmarks,1,1,1,1,1,1,0,0,0
eTour,UC51.txt,UC51.txt.flow_of_events.0,Activate the feature for the insertion of the selected site from the bookmarks,1,1,0,0,1,1,0,0,1
eTour,UC51.txt,UC51.txt.flow_of_events.1,Prompt the inclusion Confirm the input,1,1,1,0,1,1,0,0,1
eTour,UC51.txt,UC51.txt.flow_of_events.2,Inserts the selected site in the list of bookmarks,1,1,1,1,1,1,0,0,1
eTour,UC51.txt,UC51.txt.name,Insert Preference Site,1,1,1,1,1,1,0,0,0
eTour,UC51.txt,UC51.txt.postcondition,The notification about the insertion site to favorites Interruption of connection to the server ETOUR,1,0,1,0,1,1,0,0,0
eTour,UC51.txt,UC51.txt.precondition,The tourist card is in a particular site,0,0,0,0,0,0,0,0,1
eTour,UC52.txt,UC52.txt.actor,initialized by Tourist,0,0,0,0,0,0,0,0,1
eTour,UC52.txt,UC52.txt.description,Tourism delete a site from the list of bookmarks,1,1,1,1,1,1,0,0,1
eTour,UC52.txt,UC52.txt.flow_of_events.0,Choose to remove your site from the list of bookmarks by specific features,1,1,0,1,1,1,0,0,1
eTour,UC52.txt,UC52.txt.flow_of_events.1,Prompt removal Confirm the removal,1,1,1,0,1,1,0,0,1
eTour,UC52.txt,UC52.txt.flow_of_events.2,Removes the selected site from the list of bookmarks,1,1,1,1,1,1,0,0,1
eTour,UC52.txt,UC52.txt.name,Delete Site From Preferences,1,1,1,1,1,1,0,0,0
eTour,UC52.txt,UC52.txt.postcondition,The notification system has been removed from the site bookmarks The Tourist cancel the operation Interruption of the connection to the server ETOUR,1,0,1,0,1,1,0,0,1
eTour,UC52.txt,UC52.txt.precondition,The tourist card is in a particular site,0,0,0,0,0,0,0,0,1
eTour,UC53.txt,UC53.txt.actor,initialized by Tourist,0,0,0,0,0,0,0,0,1
eTour,UC53.txt,UC53.txt.description,Inserts a feedback for the selected site,1,1,1,1,1,1,0,0,0
eTour,UC53.txt,UC53.txt.flow_of_events.0,Activate the feature on the issue of feedback,1,0,0,0,1,1,0,0,1
eTour,UC53.txt,UC53.txt.flow_of_events.1,Verify that the visitor has not already issued a feedback for the site and displays a form for entering the feedback for the selected site,1,1,1,0,1,1,0,0,0
eTour,UC53.txt,UC53.txt.flow_of_events.2,In case the visitor has already issued a feedback for the site selected activates the use case Feedback Already Released,1,0,1,0,1,1,0,0,0
eTour,UC53.txt,UC53.txt.flow_of_events.3,Fill out the form selecting one vote and inserting a comment then submit,1,0,0,0,1,1,0,0,1
eTour,UC53.txt,UC53.txt.flow_of_events.4,Verify the data entered and confirm the cheide,1,1,1,0,1,1,0,0,0
eTour,UC53.txt,UC53.txt.flow_of_events.5,Where the data is invalid or insufficient the system activates the use case Errored,1,0,1,0,1,1,0,0,0
eTour,UC53.txt,UC53.txt.flow_of_events.6,Confirming the issue of feedback,1,0,0,0,1,1,0,0,1
eTour,UC53.txt,UC53.txt.flow_of_events.7,Remember feedback and inserts the selected site in the list of sites visited,1,1,1,1,1,1,0,0,0
eTour,UC53.txt,UC53.txt.name,Insert Feedback,1,1,1,1,1,1,0,0,0
eTour,UC53.txt,UC53.txt.postcondition,The system shall notify the successful combination of feedback to the site The Tourist cancel the operation Interruption of the connection to the server ETOUR,1,1,1,0,1,1,0,0,1
eTour,UC53.txt,UC53.txt.precondition,The tourist card is in a particular site,0,0,0,0,0,0,0,0,1
eTour,UC54.txt,UC54.txt.actor,initialized by Tourist,0,0,0,0,0,0,0,0,1
eTour,UC54.txt,UC54.txt.description,Edit the comment previously issued,1,1,1,1,1,1,0,0,0
eTour,UC54.txt,UC54.txt.flow_of_events.0,Choose to change the comment on the feedback for the site issued by the appropriate functionality,1,1,0,0,1,1,0,0,1
eTour,UC54.txt,UC54.txt.flow_of_events.1,Verify the data entered and asks for confirmation of the change,1,1,1,0,1,1,0,0,0
eTour,UC54.txt,UC54.txt.flow_of_events.2,Where the data is invalid or insufficient the system activates the use case Errored,1,0,1,0,1,1,0,0,0
eTour,UC54.txt,UC54.txt.flow_of_events.3,Confirm the change of the comment,1,0,0,0,1,1,0,0,1
eTour,UC54.txt,UC54.txt.flow_of_events.4,Edit commentary on selected feedback,1,1,1,1,1,1,0,0,1
eTour,UC54.txt,UC54.txt.name,Modify Comment,1,1,1,1,1,1,0,0,0
eTour,UC54.txt,UC54.txt.postcondition,The system shall notify the alterations of the comment Interruption of the connection to the server ETOUR,1,1,1,0,1,1,0,0,0
eTour,UC54.txt,UC54.txt.precondition,is in the details of a particular site,0,0,0,0,0,0,0,0,1
eTour,UC55.txt,UC55.txt.actor,initialization,0,0,0,0,0,0,0,0,1
eTour,UC55.txt,UC55.txt.flow_of_events.0,Notification that the user has already issued a feedback for the site and cancel the operation to insert a new feedback,1,1,1,0,1,1,0,0,0
eTour,UC55.txt,UC55.txt.flow_of_events.1,Confirmation of the reading of the notification,1,0,0,0,1,1,0,0,1
eTour,UC55.txt,UC55.txt.flow_of_events.2,Recovers the previous state,1,1,1,0,1,1,0,0,0
eTour,UC55.txt,UC55.txt.name,Feedback Already Released,1,1,0,0,1,1,0,0,0
eTour,UC55.txt,UC55.txt.postcondition,The system returns control to the user interaction,1,0,1,0,1,1,0,0,1
eTour,UC55.txt,UC55.txt.precondition,He already been issued with a feedback for the selected site,0,0,0,0,0,0,0,0,1
eTour,UC56.txt,UC56.txt.actor,System initialization,0,0,0,0,0,0,0,0,1
eTour,UC56.txt,UC56.txt.description,Returns the current position of the tourist,1,1,1,0,1,1,0,0,0
eTour,UC56.txt,UC56.txt.flow_of_events.0,The system requires the data for the position,1,0,1,0,1,1,0,0,0
eTour,UC56.txt,UC56.txt.flow_of_events.1,The GPS calculates the position of the tourist,1,0,1,0,1,1,0,0,0
eTour,UC56.txt,UC56.txt.flow_of_events.2,The system is on hold until the data of the position,1,0,1,0,1,1,0,0,0
eTour,UC56.txt,UC56.txt.name,Localization,1,1,1,0,1,1,0,0,0
eTour,UC56.txt,UC56.txt.postcondition,The system receives the position of the tourist The position of the tourist is not detectable by GPS,1,0,1,0,1,1,0,0,0
eTour,UC56.txt,UC56.txt.precondition,He began a search or an advanced search,0,0,0,0,0,0,0,0,1
eTour,UC56.txt,UC56.txt.quality_requirement,The GPS requirements into the transaction in more than seconds,0,0,0,0,0,0,1,1,0
eTour,UC57.txt,UC57.txt.actor,initialized by Tourist,0,0,0,0,0,0,0,0,1
eTour,UC57.txt,UC57.txt.description,The tourist searching for a site using the potential offered by the Advanced Search,1,1,1,0,1,1,0,0,1
eTour,UC57.txt,UC57.txt.flow_of_events.0,Enable the advanced search feature from your personal area,1,1,0,0,1,1,0,0,1
eTour,UC57.txt,UC57.txt.flow_of_events.1,View the advanced search form,1,1,1,0,1,1,0,0,0
eTour,UC57.txt,UC57.txt.flow_of_events.2,Fill in the form of advanced search and submit,1,0,0,0,1,1,0,0,1
eTour,UC57.txt,UC57.txt.flow_of_events.3,Gets the position of relying on the tourist event of the use location and process the request,1,0,1,0,1,1,0,0,0
eTour,UC57.txt,UC57.txt.name,Advanced Search,1,1,1,0,1,1,0,0,0
eTour,UC57.txt,UC57.txt.postcondition,The system displays a list of results Interruption of the connection to the server ETOUR,1,0,1,0,1,1,0,0,0
eTour,UC57.txt,UC57.txt.precondition,The Tourist has successfully authenticated to the system,0,0,0,0,0,0,0,0,1
eTour,UC57.txt,UC57.txt.quality_requirement,The system requirements into the transaction in more than seconds,0,0,0,0,0,0,1,1,0
eTour,UC58.txt,UC58.txt.actor,initialized by Tourist,0,0,0,0,0,0,0,0,1
eTour,UC58.txt,UC58.txt.description,View the details of a particular site,1,1,1,0,1,1,0,0,0
eTour,UC58.txt,UC58.txt.flow_of_events.0,Select the function for displaying the card on a site chosen,1,1,0,0,1,1,0,0,1
eTour,UC58.txt,UC58.txt.flow_of_events.1,Upload data from the database,1,1,1,0,1,1,0,0,0
eTour,UC58.txt,UC58.txt.name,View Site Card,1,1,1,0,1,1,0,0,0
eTour,UC58.txt,UC58.txt.postcondition,The system displays the details of the selected site Interruption of the connection to the server ETOUR,1,0,1,0,1,1,0,0,0
eTour,UC58.txt,UC58.txt.precondition,The Tourist has successfully authenticated to the system and is located in one of the following areas Research Results List of Sites Visited Sites and List of Favorites,0,0,0,0,0,0,0,0,1
iTrust,UC10E1.txt,UC10E1.txt.0,The health care professional types an invalid medical identification number and is prompted to try again,1,1,1,0,1,1,0,0,1
iTrust,UC10E2.txt,UC10E2.txt.0,The patient chosen is not the desired patient,0,0,0,0,0,0,0,0,0
iTrust,UC10E2.txt,UC10E2.txt.1,The health care professional does not confirm the selection and is prompted to try again,1,0,1,0,1,1,0,0,1
iTrust,UC10S1.txt,UC10S1.txt.0,The health care personnel enters a MID E of a patient and confirms their selection E,1,0,0,0,1,1,0,0,1
iTrust,UC10S1.txt,UC10S1.txt.1,The health care personnel may enteredit personal health information including editing historical values from Data Format and immunizations and office visit information date diagnoses medication name of attending physician but not notes laboratory procedures family history the MI Ds of the patient 's mother and father and Body Mass Index BMI S,1,1,0,1,1,1,0,0,1
iTrust,UC10S1.txt,UC10S1.txt.2,The HCP can indicate the patient has passed away providing an appropriate diagnosis code,1,1,0,1,1,1,0,0,1
iTrust,UC10S1.txt,UC10S1.txt.3,The HCP can graph height or weight of the patient over the last calendar years S,1,1,0,1,1,1,0,0,1
iTrust,UC10S2.txt,UC10S2.txt.0,For the patient the HCP can choose either height or weight to graph,1,1,0,1,1,1,0,0,1
iTrust,UC10S2.txt,UC10S2.txt.1,The HCP is presented with a line chart giving the chosen measurements either height or weight of the patient spanning the last calendar years of data averaged by quarters January- March April- June July- September October- December E,1,1,1,1,1,1,0,0,0
iTrust,UC11E1.txt,UC11E1.txt.0,The HCP types an invalid medical identification number and is prompted to try again,1,1,1,0,1,1,0,0,1
iTrust,UC11E2.txt,UC11E2.txt.0,The patient chosen is not the desired patient,0,0,0,0,0,0,0,0,0
iTrust,UC11E2.txt,UC11E2.txt.1,The health care personnel does not confirm the selection and is prompted to try again,1,0,1,0,1,1,0,0,1
iTrust,UC11S1.txt,UC11S1.txt.0,The HCP enters a MID E or name of a patient and confirms their selection E,1,0,0,0,1,1,0,0,1
iTrust,UC11S1.txt,UC11S1.txt.1,The HCP documents the office visit date hospital location of the office visit if any the default should be the HCP 's home location and notes numbers characters - ' blankspace and carriage return are all allowed input values about an office visit,1,1,1,1,1,1,0,0,1
iTrust,UC11S1.txt,UC11S1.txt.2,The HCP 's medical identification number should also be maintained,1,1,1,1,1,1,0,0,0
iTrust,UC11S1.txt,UC11S1.txt.3,Additionally the HCP can document none one or more medications NDC see Data Format prescribed S none one or more lab procedures that are ordered LOINC code see Data Format UC none one or more diagnoses via the ICD- CM code none one or more medical procedures CPT code performed and none one or more immunizations given CPT Code see UC S chosen from appropriate pull-down lists,1,1,0,1,1,1,0,0,1
iTrust,UC11S1.txt,UC11S1.txt.4,The HCP may also add a patient referral UC,1,1,0,1,1,1,0,0,1
iTrust,UC11S1.txt,UC11S1.txt.5,All events are logged UC S,1,1,1,0,1,1,0,0,0
iTrust,UC11S2.txt,UC11S2.txt.0,HC Ps can return to an office visit and modify or delete the fields of the office visit date hospital notes prescriptions laboratory procedures UC referral UC diagnoses procedures andor immunizations,1,1,0,1,1,1,0,0,1
iTrust,UC11S2.txt,UC11S2.txt.1,The event is logged UC S and the HCP is returned in the specific office visit record to verify his or her changes,1,1,1,0,1,1,0,0,1
iTrust,UC12.txt,UC12.txt.0,The software tester authenticates himself or herself in the i Trust Medical Records system UC,1,1,0,0,1,1,0,0,1
iTrust,UC12.txt,UC12.txt.1,He or she is then presented with the actual operational profile of the operations of the i Trust Medical Records where the use percentage is the of total transactions for each particular transaction logging type broken-down by each of the user types patient LHCP UHCP admin tester,1,1,1,1,1,1,0,0,0
iTrust,UC13.txt,UC13.txt.0,A patient 's DLHCP chooses to add or delete a patient 's E E personal representative by typing that person 's MID E E,1,1,0,0,1,1,0,0,1
iTrust,UC13E1.txt,UC13E1.txt.0,The health care personnel types an invalid medical identification number and is prompted to try again,1,1,1,0,1,1,0,0,1
iTrust,UC15E1.txt,UC15E1.txt.0,The administrator types an invalid code information and is prompted to try again,1,1,1,0,1,1,0,0,1
iTrust,UC15S1.txt,UC15S1.txt.0,The administrator will maintain addupdate a listing of allowable immunizations that an HCP can use,1,1,0,1,1,1,0,0,1
iTrust,UC15S1.txt,UC15S1.txt.1,The administrator will store the CPT code The CPT code set accurately describes medical surgical and diagnostic services and is designed to communicate uniform information about medical services and procedures among physicians coders patients accreditation organizations and payers for administrative financial and analytical purposes,1,1,0,1,1,1,0,0,1
iTrust,UC15S1.txt,UC15S1.txt.2,About CPT E and up to alpha characters giving the name E of the immunization,1,0,0,1,1,1,0,0,0
iTrust,UC15S2.txt,UC15S2.txt.0,The administrator will maintain a listing of allowable diagnoses that an LHCP can use,1,1,0,1,1,1,0,0,1
iTrust,UC15S2.txt,UC15S2.txt.1,The administrator will store the ICD- CM code The International Statistical Classification of Diseases and Related Health Problems most commonly known by the abbreviation ICD provides codes to classify diseases and a wide variety of signs symptoms abnormal findings complaints social circumstances and external causes of injury or disease,1,1,0,1,1,1,0,0,1
iTrust,UC15S2.txt,UC15S2.txt.2,NHCS Classification of Diseases Functioning and Disability for the diagnosis E a classification that the diagnosis is either chroniclong-term OR short term and up to alphanumeric characters giving the name E of the diagnosis,1,0,0,1,1,1,0,0,0
iTrust,UC15S3.txt,UC15S3.txt.0,The administrator will maintain addupdate a listing of allowable drugs that an HCP can use,1,1,0,1,1,1,0,0,1
iTrust,UC15S3.txt,UC15S3.txt.1,The administrator will store the National Drug Code The National Drug Code NDC is a universal product identifier used in the United States for drugs intended for human use,1,1,0,1,1,1,0,0,1
iTrust,UC15S3.txt,UC15S3.txt.2,National Drug Code Directory,0,0,0,0,0,0,0,0,0
iTrust,UC15S4.txt,UC15S4.txt.0,The administrator will maintain addupdate a listing of allowable physical services including laboratory procedures that an HCP can use,1,1,0,1,1,1,0,0,1
iTrust,UC15S4.txt,UC15S4.txt.1,The administrator will store information of a LOINC code Logical Observation Identifiers Names and Codes LOINC is a database and universal standard for identifying medical laboratory observations,1,1,0,1,1,1,0,0,1
iTrust,UC15S4.txt,UC15S4.txt.2,LOINC co Medical Informatics E according to Data Format,0,0,0,0,0,0,0,0,0
iTrust,UC16.txt,UC16.txt.0,Through the Personal Health Records page an LHCP chooses a chronic disease and a patient,1,1,0,0,1,1,0,0,1
iTrust,UC16.txt,UC16.txt.1,The data in the database is analyzed according to the risk factors for the disease to determine if the patient exhibits a certain risk factor,1,1,1,1,1,1,0,0,0
iTrust,UC16.txt,UC16.txt.2,Currently available risk factors for chronic diseases are defined for Diabetes and Type and Type and Heart Disease,1,1,0,1,1,1,0,0,0
iTrust,UC16.txt,UC16.txt.3,When the chosen patient satisfies the preconditions of the chosen chronic disease E the LHCP is provided with a warning message if that patient exhibits three or more risk factors,1,1,1,1,1,1,0,0,0
iTrust,UC16.txt,UC16.txt.4,The message will display the risk factors that the patients exhibit,1,1,1,0,1,1,0,0,0
iTrust,UC16E1.txt,UC16E1.txt.0,The LHCP chooses to examine a patient for which the preconditions do not apply eg an adult should n't be tested for child diabetes and the LHCP is prompted that no analysis can occur,1,1,1,0,1,1,0,0,1
iTrust,UC17S1.txt,UC17S1.txt.0,An alive patient who has not had an office visit for more than one year and who has been diagnosed with diabetes mellitus is diagnosed with ICD code beginning with asthma is diagnosed with ICD code beginning with or circulatory-system disease is diagnosed with an ICD code between and inclusive,0,0,0,0,0,0,0,0,1
iTrust,UC17S2.txt,UC17S2.txt.0,An alive patient over years old who has not had a flu shot CPT codes per http wwwinfluenzacomindexcfm fa ADDITIONALRESHC during the months Sept - Dec of the last calendar year or during the months Sept - Dec of the current calendar year if the retrieval time is between Sept - Dec,0,0,0,0,0,0,0,0,1
iTrust,UC17S3.txt,UC17S3.txt.0,An alive patient under the age of who has not had proper immunizations per the immunization schedule,0,0,0,0,0,0,0,0,1
iTrust,UC17S3.txt,UC17S3.txt.1,The catch up schedule is relevant when the patient did not begin the immunizations according to the recommended schedule,0,0,0,0,0,0,0,0,1
iTrust,UC18E1.txt,UC18E1.txt.0,The administrator types an invalid hospital ID and is prompted to try again,1,1,1,0,1,1,0,0,1
iTrust,UC18E2.txt,UC18E2.txt.0,The administrator types an invalid hospital name and is prompted to try again,1,1,1,0,1,1,0,0,1
iTrust,UC18S1.txt,UC18S1.txt.0,The administrator will store hospital Id number for the hospital E and up to alphanumeric characters giving the name of the hospital,1,1,0,1,1,1,0,0,1
iTrust,UC18S2.txt,UC18S2.txt.0,The system shall enable the administrator to add a new entry for a hospital or modify the hospital name in an existing entry,1,1,0,1,1,1,0,0,1
iTrust,UC18S2.txt,UC18S2.txt.1,Note that the administrator is not allowed through the system interface to delete an existing entry or modify the hospital ID number in an existing entry,1,1,0,1,1,1,0,0,1
iTrust,UC19E1.txt,UC19E1.txt.0,The LHCP types an invalid medical identification number and is prompted to try again,1,1,1,0,1,1,0,0,1
iTrust,UC19E2.txt,UC19E2.txt.0,The patient chosen is not the desired patient,0,0,0,0,0,0,0,0,0
iTrust,UC19E2.txt,UC19E2.txt.1,The LHCP does not confirm the selection and is prompted to try again,1,0,1,0,1,1,0,0,1
iTrust,UC19S1.txt,UC19S1.txt.0,The user patient or personal health representative can choose to view a list of their own prescriptions or the prescriptions for whom the user is a person health representative by choosing one patient from a a list of these patients,1,1,0,1,1,1,0,0,1
iTrust,UC19S1.txt,UC19S1.txt.1,A prescription list is then displayed S sorted by start date the later date is ranked earlier,1,1,1,1,1,1,0,0,0
iTrust,UC19S2.txt,UC19S2.txt.0,The user LHCP selects a patient from the list of requested reports,1,0,0,0,1,1,0,0,1
iTrust,UC19S2.txt,UC19S2.txt.1,At this point the LHCP can view a prescription list for that patient S sorted by start date the later date is ranked earlier,1,1,1,1,1,1,0,0,1
iTrust,UC19S3.txt,UC19S3.txt.0,The prescription report is titled with the patient name,1,0,0,1,1,1,0,0,0
iTrust,UC19S3.txt,UC19S3.txt.1,The prescription list includes medication date prescribed start date end date for each prescription and the name of the doctor who prescribed the medication,1,0,0,1,1,1,0,0,0
iTrust,UC1E1.txt,UC1E1.txt.0,The system prompts the enterereditor to correct the format of a required data field because the input of that data field does not match that specified in data format for patients,1,1,1,0,1,1,0,0,0
iTrust,UC1E2.txt,UC1E2.txt.0,The enterereditor is presented with the name of the user and determines if it is invalid or not the right person,1,1,1,0,1,1,0,0,1
iTrust,UC1E2.txt,UC1E2.txt.1,The enterereditor is prompted to try again,1,0,1,0,1,1,0,0,1
iTrust,UC1S1.txt,UC1S1.txt.0,The HCP enters a patient as a new user of i Trust Medical Records system,1,1,0,1,1,1,0,0,1
iTrust,UC1S1.txt,UC1S1.txt.1,Only the name and email are is provided,1,0,1,1,1,1,0,0,0
iTrust,UC1S1.txt,UC1S1.txt.2,The patient 's assigned MID and a secret key the initial password is personally provided to the user with which the user can reset hisher password,1,1,1,1,1,1,0,0,1
iTrust,UC1S1.txt,UC1S1.txt.3,The HCP can edit the patient according to data format E with all initial values except patient MID defaulting to null andor as appropriate,1,1,0,0,1,1,0,0,1
iTrust,UC1S1.txt,UC1S1.txt.4,Patient MID should be the number assigned when the patient is added to the system and can not be edited,1,1,1,0,1,1,0,0,0
iTrust,UC1S1.txt,UC1S1.txt.5,The HCP does not have the ability to entereditview the patient 's security questionpassword,0,0,0,0,0,0,0,0,1
iTrust,UC1S2.txt,UC1S2.txt.0,The HCP provides a deceased date data format,1,0,1,1,1,1,0,0,1
iTrust,UC1S2.txt,UC1S2.txt.1,An optional diagnosis code is entered as the cause of death,1,0,0,0,1,1,0,0,1
iTrust,UC21E1.txt,UC21E1.txt.0,The LHCP types an invalid medical identification number and is prompted to try again,1,0,1,0,1,1,0,0,1
iTrust,UC21E2.txt,UC21E2.txt.0,The patient chosen is not the desired patient,0,0,0,0,0,0,0,0,0
iTrust,UC21E2.txt,UC21E2.txt.1,The LHCP or ER does not confirm the selection and is prompted to try again,1,0,1,0,1,1,0,0,1
iTrust,UC21S1.txt,UC21S1.txt.0,The LHCP or ER enters a MID E and confirms the input E,1,0,0,0,1,1,0,0,1
iTrust,UC22E1.txt,UC22E1.txt.0,The user inputs invalid information and is prompted to try again,1,0,1,0,1,1,0,0,1
iTrust,UC22E2.txt,UC22E2.txt.0,The comment is empty and the text No Comment without link is displayed instead of the Read Comment link,1,0,1,0,1,1,0,0,0
iTrust,UC22S1.txt,UC22S1.txt.0,The system shall enable the administrator to add a new entry for an appointment type including its type name with up to alpha characters and duration in the unit of minutes E and modify the duration in an existing entry E,1,1,0,1,1,1,0,0,1
iTrust,UC22S1.txt,UC22S1.txt.1,A new entry shall not have the same type name as that of any existing entry E,1,0,1,0,1,1,0,0,0
iTrust,UC22S1.txt,UC22S1.txt.2,Note that the administrator is not allowed through the system interface to delete an existing entry or modify the appointment type name in an existing entry,1,1,0,1,1,1,0,0,1
iTrust,UC22S2.txt,UC22S2.txt.0,The LHCP chooses to schedule an appointment with a patient it is assumed that the LHCP and patient have already worked out the details of the appointment in person or via telephone outside of the system,1,1,0,0,1,1,0,0,1
iTrust,UC22S2.txt,UC22S2.txt.1,The LHCP enters the patient MID selects the type of appointment from a pull-down menu of the existing appointment types enter the appointment date and start time only a datetime equal or after the current datetime is allowed,1,0,0,1,1,1,0,0,1
iTrust,UC22S2.txt,UC22S2.txt.2,The user interface shall provide both the option of typing in a specific date in the date format and the option of selecting a date from a calendar for the current month enter comment optional up to characters such as reason for the appointment E,1,1,0,0,1,1,0,0,0
iTrust,UC22S3.txt,UC22S3.txt.0,A user an LHCP or patient wishes to view a list of his or her upcoming appointments ie a list including appointments whose appointment date and start time is equal or later than the current datetime,1,1,0,0,1,1,0,0,1
iTrust,UC22S3.txt,UC22S3.txt.1,The user chooses to open his or her upcoming appointment list,1,1,0,0,1,1,0,0,1
iTrust,UC22S3.txt,UC22S3.txt.2,Each row in the list includes the appointment type appointment date and start time duration and the name of either the patient only for the user being an LHCP or the LHCP only for the user being a patient,1,0,1,1,1,1,0,0,0
iTrust,UC22S3.txt,UC22S3.txt.3,The appointments in the list shall be ordered by appointment date and start time the soonest upcoming first,1,0,1,1,1,1,0,0,0
iTrust,UC22S3.txt,UC22S3.txt.4,The row for each conflicting appointment is highlighted in bold a conflicting appointment is one that has overlap in its appointment duration period with that of at least another appointment of the same user,1,0,1,0,1,1,0,0,0
iTrust,UC22S3.txt,UC22S3.txt.5,When viewing the calendar the user selects an appointment from the list to read comment by clicking the Read Comment link beside the row for the appointment and then the comment for the appointment shall be displayed in a new page E,1,1,1,1,1,1,0,0,1
iTrust,UC23E1.txt,UC23E1.txt.0,The LHCP types an invalid MID and is prompted to try again,1,0,1,0,1,1,0,0,1
iTrust,UC23E2.txt,UC23E2.txt.0,The chosen patient is not the desired patient,0,0,0,0,0,0,0,0,0
iTrust,UC23E2.txt,UC23E2.txt.1,The LHCP does not confirm the selection and can try again,1,0,0,0,1,1,0,0,1
