ProjectID,file,ID,text,functional,Function,Behavior,Data,OnlyF,F,OnlyQ,Q,UserRelated
eAnci,EA16.txt,EA16.txt.postcondition,The password is changed OR In the case where the administrator enters a password of less than characters or the old password is incorrect the system calls the use case Data Errati OR In case the service is not available the use case Service Not Available is called,1,0,1,1,1,1,0,0,1
eAnci,EA16.txt,EA16.txt.precondition,The 'administrator has authenticated into the system,0,0,0,0,0,0,0,0,1
eAnci,EA16.txt,EA16.txt.quality_requirement,Not expected,0,0,0,0,0,0,0,0,0
eAnci,EA17.txt,EA17.txt.actor,Started by citizen,0,0,0,0,0,0,0,0,1
eAnci,EA17.txt,EA17.txt.flow_of_events.0,Citizen wants to change password and presses the change password button,1,1,0,0,1,1,0,0,1
eAnci,EA17.txt,EA17.txt.flow_of_events.1,The system displays the form for entering the old password and the new password,1,1,1,1,1,1,0,0,0
eAnci,EA17.txt,EA17.txt.flow_of_events.2,The citizen enters the old password the new password and presses the confirm button,1,0,0,0,1,1,0,0,1
eAnci,EA17.txt,EA17.txt.flow_of_events.3,The system notifies that the password has been changed,1,1,1,0,1,1,0,0,0
eAnci,EA17.txt,EA17.txt.name,Edit Password Citizen,1,1,1,1,1,1,0,0,0
eAnci,EA17.txt,EA17.txt.postcondition,The password is changed OR In case the citizen enters a password of less than characters or the old password is incorrect the system calls the use case Data Errati OR In the case where the service is not available the use case Service Not Available is called,1,0,1,1,1,1,0,0,1
eAnci,EA17.txt,EA17.txt.precondition,The citizen has authenticated into the system,0,0,0,0,0,0,0,0,1
eAnci,EA17.txt,EA17.txt.quality_requirement,The password string consists of az AZ- and is between and characters long The string is not consistent with the password entered,0,0,0,0,0,0,0,0,0
eAnci,EA18.txt,EA18.txt.actor,Started by employee,0,0,0,0,0,0,0,0,1
eAnci,EA18.txt,EA18.txt.flow_of_events.0,The employee wants to change the password and presses the change password button,1,1,0,0,1,1,0,0,1
eAnci,EA18.txt,EA18.txt.flow_of_events.1,The system displays the form for entering the old password and the new one,1,1,1,1,1,1,0,0,0
eAnci,EA18.txt,EA18.txt.flow_of_events.2,The employee enters the old password the new password and presses the confirm button,1,0,0,0,1,1,0,0,1
eAnci,EA18.txt,EA18.txt.flow_of_events.3,The system notifies that the password has been changed,1,1,1,0,1,1,0,0,0
eAnci,EA18.txt,EA18.txt.name,Edit Password Employee,1,1,1,1,1,1,0,0,0
eAnci,EA18.txt,EA18.txt.postcondition,The password is changed OR In the case where the employee enters a password of less than characters or the old password is incorrect the system calls the use case Data Errati OR In case the service is not available the use case Service Not Available is called,1,0,1,1,1,1,0,0,1
eAnci,EA18.txt,EA18.txt.precondition,The 'employee has authenticated into the system,0,0,0,0,0,0,0,0,1
eAnci,EA18.txt,EA18.txt.quality_requirement,Not expected,0,0,0,0,0,0,0,0,0
eAnci,EA19.txt,EA19.txt.actor,Started by Citizen,0,0,0,0,0,0,0,0,1
eAnci,EA19.txt,EA19.txt.flow_of_events.0,Citizen has forgotten password and presses on the Recover Password button,1,1,0,0,1,1,0,0,1
eAnci,EA19.txt,EA19.txt.flow_of_events.1,The system displays the password recovery screen that requires entering the user name and ID card code,1,1,1,0,1,1,0,0,0
eAnci,EA19.txt,EA19.txt.flow_of_events.2,The citizen enters hisher data and presses the confirmation button,1,0,0,0,1,1,0,0,1
eAnci,EA19.txt,EA19.txt.flow_of_events.3,The system verifies the correctness of the data and sends the password to the citizen 's email address,1,1,1,1,1,1,0,0,0
eAnci,EA19.txt,EA19.txt.name,Recover Password Citizen,1,1,1,1,1,1,0,0,0
eAnci,EA19.txt,EA19.txt.postcondition,The system has sent the password OR In the case where the administrator enters a matriculation number that is not in the system the system calls the use case Data Errati OR In the case where the service is not available the use case Service Not Available is called,1,0,1,1,1,1,0,0,1
eAnci,EA19.txt,EA19.txt.precondition,The citizen has authenticated in the system,0,0,0,0,0,0,0,0,1
eAnci,EA19.txt,EA19.txt.quality_requirement,The username string present in the system and associated with the ID card holder is well formed contains characters az AZ - and is less than characters long and is not empty Identity Card string is present in the system is well formed X Xnnnnnnn X letter n number and has a length equal to characters,0,0,0,0,0,0,0,0,0
eAnci,EA20.txt,EA20.txt.actor,Started by administrator,0,0,0,0,0,0,0,0,1
eAnci,EA20.txt,EA20.txt.flow_of_events.0,The administrator has forgotten the password and presses the password recovery button,1,1,0,0,1,1,0,0,1
eAnci,EA20.txt,EA20.txt.flow_of_events.1,The system shows the form for entering the freshman,1,1,1,1,1,1,0,0,0
eAnci,EA20.txt,EA20.txt.flow_of_events.2,The administrator enters hisher matriculation number and presses the confirmation button,1,0,0,0,1,1,0,0,1
eAnci,EA20.txt,EA20.txt.flow_of_events.3,The system verifies the data and sends the password to the administrator 's email address,1,1,1,1,1,1,0,0,0
eAnci,EA20.txt,EA20.txt.name,Recovery Password Administrator,1,1,1,1,1,1,0,0,0
eAnci,EA20.txt,EA20.txt.postcondition,The system sends the password OR In the case where the administrator enters a serial number that is not in the system the system calls the use case Data Errati OR In the case where the service is not available the use case Service Not Available is called,1,0,1,1,1,1,0,0,1
eAnci,EA20.txt,EA20.txt.precondition,The administrator has access to the system,0,0,0,0,0,0,0,0,1
eAnci,EA20.txt,EA20.txt.quality_requirement,Not expected,0,0,0,0,0,0,0,0,0
eAnci,EA21.txt,EA21.txt.actor,Started by employee,0,0,0,0,0,0,0,0,1
eAnci,EA21.txt,EA21.txt.flow_of_events.0,The employee has forgotten the password and presses the password recovery button,1,1,0,0,1,1,0,0,1
eAnci,EA21.txt,EA21.txt.flow_of_events.1,The system displays the form for entering the matriculation number,1,1,1,0,1,1,0,0,0
eAnci,EA21.txt,EA21.txt.flow_of_events.2,The employee enters hisher matriculation number and presses the confirmation button,1,0,0,0,1,1,0,0,1
eAnci,EA21.txt,EA21.txt.flow_of_events.3,The system verifies the data and sends the password to the employee 's email address,1,1,1,1,1,1,0,0,0
eAnci,EA21.txt,EA21.txt.name,Recovery Password Employee,1,1,1,1,1,1,0,0,0
eAnci,EA21.txt,EA21.txt.postcondition,The system sends the password OR In the case where the employee enters a serial number that is not in the system the system calls the use case Data Errati OR In the case where the service is not available the use case Service Not Available is called,1,0,1,1,1,1,0,0,1
eAnci,EA21.txt,EA21.txt.precondition,The employee has authenticated into the system,0,0,0,0,0,0,0,0,1
eAnci,EA21.txt,EA21.txt.quality_requirement,Not expected,0,0,0,0,0,0,0,0,0
eAnci,EA22.txt,EA22.txt.actor,Started by Citizen,0,0,0,0,0,0,0,0,1
eAnci,EA22.txt,EA22.txt.flow_of_events.0,Citizen accesses the registration form,1,1,0,0,1,1,0,0,1
eAnci,EA22.txt,EA22.txt.flow_of_events.1,The system displays the form for registration,1,1,1,1,1,1,0,0,0
eAnci,EA22.txt,EA22.txt.flow_of_events.2,The citizen enters hisher data and presses the confirmation button,1,0,0,0,1,1,0,0,1
eAnci,EA22.txt,EA22.txt.flow_of_events.3,The system verifies the correctness of the data saves them and sends an e-mail of successful registration to the citizen,1,1,1,0,1,1,0,0,0
eAnci,EA22.txt,EA22.txt.name,Registration Citizen,1,1,1,1,1,1,0,0,0
eAnci,EA22.txt,EA22.txt.postcondition,The system registers the citizen OR In case the citizen enters incorrect data the system calls the case use case Data Errati OR In the case where the service is not available the use case Service Not Available is called,1,0,1,1,1,1,0,0,1
eAnci,EA22.txt,EA22.txt.precondition,The citizen has accessed the system,0,0,0,0,0,0,0,0,1
eAnci,EA22.txt,EA22.txt.quality_requirement,The name string corresponding to the name of the ID card holder is well formed contains characters az AZ ' and is less than characters long and is not empty The string of the last name corresponding to the first name of the ID card holder is well-formed contains characters az AZ ' and has length less than characters and is not empty The string of the Tax Code corresponding to the actual tax code of the holder is in accordance with regulations and has length of characters The Identity Card string is present in the system consists of X Xnnnnnnn X letter n number and has length of characters The email string consists of x xx and has a length of less than characters and is not empty The username string is not already in the system is well formed contains characters az AZ - and has length less than characters and is not empty The password string is well formed contains characters az AZ - and has a length between and characters,0,0,0,0,0,0,0,0,0
eAnci,EA23.txt,EA23.txt.actor,Started by Citizen,0,0,0,0,0,0,0,0,1
eAnci,EA23.txt,EA23.txt.flow_of_events.0,Citizen accesses the registration form,1,1,0,0,1,1,0,0,1
eAnci,EA23.txt,EA23.txt.flow_of_events.1,The system displays the form for registration,1,1,1,1,1,1,0,0,0
eAnci,EA23.txt,EA23.txt.flow_of_events.2,The citizen enters hisher data and presses the confirmation button,1,0,0,0,1,1,0,0,1
eAnci,EA23.txt,EA23.txt.flow_of_events.3,The system verifies the correctness of the data saves them and sends an e-mail of successful registration to the citizen,1,1,1,0,1,1,0,0,0
eAnci,EA23.txt,EA23.txt.name,Registration Citizen,1,1,1,1,1,1,0,0,0
eAnci,EA23.txt,EA23.txt.postcondition,The system registers the citizen OR In case the citizen enters incorrect data the system calls the case use case Data Errati OR In the case where the service is not available the use case Service Not Available is called,1,0,1,1,1,1,0,0,1
eAnci,EA23.txt,EA23.txt.precondition,The citizen has accessed the system,0,0,0,0,0,0,0,0,1
eAnci,EA23.txt,EA23.txt.quality_requirement,The name string corresponding to the name of the ID card holder is well formed contains characters az AZ ' and is less than characters long and is not empty The string of the last name corresponding to the first name of the ID card holder is well-formed contains characters az AZ ' and has length less than characters and is not empty The string of the Tax Code corresponding to the actual tax code of the holder is in accordance with regulations and has length of characters The Identity Card string is present in the system consists of X Xnnnnnnn X letter n number and has length of characters The email string consists of x xx and has a length of less than characters and is not empty The username string is not already in the system is well formed contains characters az AZ - and has length less than characters and is not empty The password string is well formed contains characters az AZ - and has a length between and characters,0,0,0,0,0,0,0,0,0
eAnci,EA24.txt,EA24.txt.actor,Started by administrator,0,0,0,0,0,0,0,0,1
eAnci,EA24.txt,EA24.txt.flow_of_events.0,The administrator presses on the Search Employee button,1,0,0,0,1,1,0,0,1
eAnci,EA24.txt,EA24.txt.flow_of_events.1,The system displays the form to search for an employee,1,1,1,0,1,1,0,0,0
eAnci,EA24.txt,EA24.txt.flow_of_events.2,The administrator performs a search using the employee 's data,1,1,0,1,1,1,0,0,1
eAnci,EA24.txt,EA24.txt.flow_of_events.3,The system returns the data of the searched employee,1,1,1,1,1,1,0,0,0
eAnci,EA24.txt,EA24.txt.name,Research Employee,1,1,1,1,1,1,0,0,0
eAnci,EA24.txt,EA24.txt.postcondition,The system displays the screen of the clerk OR In the case where the clerk is not found the system retrieves the use case Data Errati OR In case the administrator wants to delete an employee the system calls the use case Delete Employee OR In the case where the administrator wants to edit an employee the system calls the use case Edit Employee OR In the case where the service is not available the use case Service Not Available is called,1,1,1,1,1,1,0,0,1
eAnci,EA24.txt,EA24.txt.precondition,The administrator has authenticated into the system,0,0,0,0,0,0,0,0,1
eAnci,EA24.txt,EA24.txt.quality_requirement,The matricula string is present in the system contains only numeric characters and has a length of characters,0,0,0,0,0,0,0,0,0
eAnci,EA25.txt,EA25.txt.actor,Started by citizen continued employee,0,0,0,0,0,0,0,0,1
eAnci,EA25.txt,EA25.txt.flow_of_events.0,The Citizen presses on the Change of Residence button,1,0,0,0,1,1,0,0,1
eAnci,EA25.txt,EA25.txt.flow_of_events.1,The system shows the citizen the form to fill out,1,1,1,0,1,1,0,0,0
eAnci,EA25.txt,EA25.txt.flow_of_events.2,The citizen enters the data of hisher new residence,1,0,0,1,1,1,0,0,1
eAnci,EA25.txt,EA25.txt.flow_of_events.3,The system notifies the citizen that the request has been successfully submitted and is stored in the system,1,0,1,0,1,1,0,0,0
eAnci,EA25.txt,EA25.txt.flow_of_events.4,The clerk logs into the system and views the request received,1,1,0,0,1,1,0,0,1
eAnci,EA25.txt,EA25.txt.flow_of_events.5,The clerk verifies the data fills in the document with the rest of the data to be entered and confirms the operation,1,0,0,0,1,1,0,0,1
eAnci,EA25.txt,EA25.txt.flow_of_events.6,The system saves the form and updates the data,1,0,1,0,1,1,0,0,0
eAnci,EA25.txt,EA25.txt.name,Change Of Residence,1,1,1,1,1,1,0,0,0
eAnci,EA25.txt,EA25.txt.postcondition,The System creates the document to be delivered to the appropriate office OR In the case where the service is not available the use case Service Not Available is invoked,1,0,1,1,1,1,0,0,0
eAnci,EA25.txt,EA25.txt.precondition,The Citizen has authenticated in the system,0,0,0,0,0,0,0,0,1
eAnci,EA25.txt,EA25.txt.quality_requirement,The string common name new residence can contain characters az AZ ' and the string must be non-empty The address string may contain characters az AZ ' and the string must be nonempty The house number string may contain characters AZ and the string must be less than characters long The phone prefix string can contain only numeric characters and must be between and digits long The phone number string can contain only numeric characters and must be between and digits long The family member last name string can include characters az AZ ' and have a maximum length of carat and non-empty The family comp name string can include characters az AZ ' and have a maximum length of carat and non-empty The familiar comp birthplace string may contain characters az AZ ' and must be at least one character The string birth date comp familiar must be an existing date and must have a ddmmyyyy format of numeric type dd from to mm from to yyyy from to present The string card code applicant outside the municipality must be X Xnnnnnnn X letter n number and must have a length of characters,0,0,0,0,0,0,0,0,0
eAnci,EA26.txt,EA26.txt.actor,Started by Citizen continued by Employee,0,0,0,0,0,0,0,0,1
eAnci,EA26.txt,EA26.txt.flow_of_events.0,The Citizen presses on the Change of Residence button,1,0,0,0,1,1,0,0,1
eAnci,EA26.txt,EA26.txt.flow_of_events.1,The system shows the citizen the form to fill out,1,1,1,0,1,1,0,0,0
eAnci,EA26.txt,EA26.txt.flow_of_events.2,The citizen enters the data of hisher new residence,1,0,0,1,1,1,0,0,1
eAnci,EA26.txt,EA26.txt.flow_of_events.3,The system notifies the citizen that the request has been successfully submitted and the request is stored,1,0,1,0,1,1,0,0,0
eAnci,EA26.txt,EA26.txt.flow_of_events.4,The clerk logs into the system and views the request received,1,1,0,0,1,1,0,0,1
eAnci,EA26.txt,EA26.txt.flow_of_events.5,The clerk verifies the data fills in the document with the rest of the data to be entered and confirms the operation,1,0,0,0,1,1,0,0,1
eAnci,EA26.txt,EA26.txt.flow_of_events.6,The system saves the form and updates the data,1,1,1,0,1,1,0,0,0
eAnci,EA26.txt,EA26.txt.flow_of_events.7,The clerk sends a document with the request made by the citizen to the clerk of the other municipality,1,1,0,1,1,1,0,0,1
eAnci,EA26.txt,EA26.txt.flow_of_events.8,The clerk of the other municipality verifies the document and sends a positive notification to the other clerk and a notification to the citizen,1,0,0,0,1,1,0,0,1
eAnci,EA26.txt,EA26.txt.name,Change Of Residence Other Community,1,1,1,1,1,1,0,0,0
eAnci,EA26.txt,EA26.txt.postcondition,The System creates the document to be delivered to the appropriate office OR In the case where the service is not available the use case Service Not Available is invoked,1,0,1,1,1,1,0,0,0
eAnci,EA26.txt,EA26.txt.precondition,The Citizen has authenticated in the system,0,0,0,0,0,0,0,0,1
eAnci,EA26.txt,EA26.txt.quality_requirement,The string common name new residence can contain characters az AZ ' and the string must be non-empty The address string may contain characters az AZ ' and the string must be nonempty The house number string may contain characters AZ and the string must be less than characters long The phone prefix string can contain only numeric characters and must be between and digits long The phone number string can contain only numeric characters and must be between and digits long The family member last name string may include characters az AZ ' and have a maximum length of characters and not empty The family member first name string can include characters az AZ ' and have a maximum length of carat and non-empty The familiar comp birthplace string may contain characters az AZ ' and must be at least one character long The family comp birth date string must be an existing date and must have a ddmmyyyy format of numeric type dd from to mm from to yyyy from to present The string card code applicant outside the municipality must be X Xnnnnnnn X letter n number and must have a length of characters,0,0,0,0,0,0,0,0,0
eAnci,EA27.txt,EA27.txt.actor,Started by Citizen continued by Employee,0,0,0,0,0,0,0,0,1
eAnci,EA27.txt,EA27.txt.flow_of_events.0,Citizen presses on the Change Family Status button,1,0,0,0,1,1,0,0,1
eAnci,EA27.txt,EA27.txt.flow_of_events.1,The system shows the citizen the form to fill out,1,1,1,0,1,1,0,0,0
eAnci,EA27.txt,EA27.txt.flow_of_events.2,The citizen enters the new household data and submits the request,1,0,0,1,1,1,0,0,1
eAnci,EA27.txt,EA27.txt.flow_of_events.3,The system sends the request to the appropriate clerk,1,0,1,0,1,1,0,0,0
eAnci,EA27.txt,EA27.txt.name,Change State Of Family,1,1,1,1,1,1,0,0,0
eAnci,EA27.txt,EA27.txt.postcondition,The System creates the document to be delivered to the appropriate office OR In the case where the service is not available the use case Service Not Available is invoked,1,0,1,1,1,1,0,0,0
eAnci,EA27.txt,EA27.txt.precondition,The Citizen has authenticated in the system,0,0,0,0,0,0,0,0,1
eAnci,EA27.txt,EA27.txt.quality_requirement,Not Available,0,0,0,0,0,0,0,0,0
eAnci,EA28.txt,EA28.txt.actor,Started by citizen,0,0,0,0,0,0,0,0,1
eAnci,EA28.txt,EA28.txt.flow_of_events.0,Citizen presses the cancel file button ID Card Change of Residence if the file has not been initialized,1,0,0,0,1,1,0,0,1
eAnci,EA28.txt,EA28.txt.flow_of_events.1,The system asks the citizen for confirmation,1,0,1,0,1,1,0,0,0
eAnci,EA28.txt,EA28.txt.flow_of_events.2,The citizen confirms the operation,1,0,0,0,1,1,0,0,1
eAnci,EA28.txt,EA28.txt.flow_of_events.3,The system deletes the practice,1,1,1,1,1,1,0,0,0
eAnci,EA28.txt,EA28.txt.name,Clear Practice,1,1,1,1,1,1,0,0,0
eAnci,EA28.txt,EA28.txt.postcondition,The citizen does not confirm the transaction OR The system deletes the practice OR In the case where the service is not available the use case is invoked of use Service Not Available,1,0,1,1,1,1,0,0,1
eAnci,EA28.txt,EA28.txt.precondition,The citizen has authenticated into the system This use case extends View Practice and occurs when the citizen wants to delete the practice,0,0,0,0,0,0,0,0,1
eAnci,EA28.txt,EA28.txt.quality_requirement,Not Provided,0,0,0,0,0,0,0,0,0
eAnci,EA29.txt,EA29.txt.actor,Started by citizen,0,0,0,0,0,0,0,0,1
eAnci,EA29.txt,EA29.txt.flow_of_events.0,Citizen presses the Edit Practice button ID Card Change of Residence if the practice has not been initialized,1,0,0,0,1,1,0,0,1
eAnci,EA29.txt,EA29.txt.flow_of_events.1,The system displays a form for editing the practice,1,1,1,1,1,1,0,0,0
eAnci,EA29.txt,EA29.txt.flow_of_events.2,The citizen enters the data,1,0,0,0,1,1,0,0,1
eAnci,EA29.txt,EA29.txt.flow_of_events.3,The system saves the changes made,1,0,1,0,1,1,0,0,0
eAnci,EA29.txt,EA29.txt.name,Edit Practice,1,1,1,1,1,1,0,0,0
eAnci,EA29.txt,EA29.txt.postcondition,The system edits the practice OR In the case where the service is not available the use case is invoked of use Service Not Available,1,0,1,1,1,1,0,0,0
eAnci,EA29.txt,EA29.txt.precondition,The citizen has authenticated into the system This use case extends View Practice and occurs when the citizen wants to edit the file,0,0,0,0,0,0,0,0,1
eAnci,EA29.txt,EA29.txt.quality_requirement,Not Provided,0,0,0,0,0,0,0,0,0
eAnci,EA30.txt,EA30.txt.actor,Started by Citizen continued employee,0,0,0,0,0,0,0,0,1
eAnci,EA30.txt,EA30.txt.flow_of_events.0,Citizen views family status and selects a family member,1,0,0,1,1,1,0,0,1
eAnci,EA30.txt,EA30.txt.flow_of_events.1,The system displays a form for entering personal data Height special marks etc,1,1,1,1,1,1,0,0,0
eAnci,EA30.txt,EA30.txt.flow_of_events.2,The Citizen enters the data selects the payment method and presses the confirm button,1,0,0,0,1,1,0,0,1
eAnci,EA30.txt,EA30.txt.flow_of_events.3,The system shows the screen with the documentation to be shown at the counter on the days and hours the office is open,1,1,1,0,1,1,0,0,0
eAnci,EA30.txt,EA30.txt.flow_of_events.4,The citizen confirms the transaction,1,0,0,0,1,1,0,0,1
eAnci,EA30.txt,EA30.txt.flow_of_events.5,The system notifies the clerk of the request,1,1,1,0,1,1,0,0,0
eAnci,EA30.txt,EA30.txt.name,Identity Card Request,1,1,1,1,1,1,0,0,0
eAnci,EA30.txt,EA30.txt.postcondition,The clerk receives the file and chooses whether to accept it or not by calling the use case Request Card Of Identity Rejected or Request Card Of Identity Accepted OR respectively In the case where the service is not available the use case Service Not Available is invoked,1,0,1,1,1,1,0,0,1
eAnci,EA30.txt,EA30.txt.precondition,The Citizen has authenticated in the system The citizen exercises parental authority over the person concerned,0,0,0,0,0,0,0,0,1
eAnci,EA31.txt,EA31.txt.actor,Started by Employee continued citizen,0,0,0,0,0,0,0,0,1
eAnci,EA31.txt,EA31.txt.flow_of_events.0,The clerk displays the notification received,1,0,0,0,1,1,0,0,1
eAnci,EA31.txt,EA31.txt.flow_of_events.1,The system shows the clerk the request for the creation of the ID card by by the citizen,1,1,1,1,1,1,0,0,0
eAnci,EA31.txt,EA31.txt.flow_of_events.2,The clerk certifies the validity of the request by checking the accuracy of the data and enables the ID card creation procedure,1,1,0,0,1,1,0,0,1
eAnci,EA31.txt,EA31.txt.flow_of_events.3,The system sends a confirmation e-mail to the citizen who requested the creation of the ID card,1,1,1,0,1,1,0,0,0
eAnci,EA31.txt,EA31.txt.flow_of_events.4,The citizen goes to the counter,0,0,0,0,0,0,0,0,1
eAnci,EA31.txt,EA31.txt.name,Request Accepted Identity Card,1,1,1,1,1,1,0,0,0
eAnci,EA31.txt,EA31.txt.postcondition,The system notifies the citizen,1,0,1,0,1,1,0,0,0
eAnci,EA31.txt,EA31.txt.precondition,The clerk has authenticated into the system This use case extends Request Identity Card and occurs when the clerk confirms the request of the citizen,0,0,0,0,0,0,0,0,1
eAnci,EA31.txt,EA31.txt.quality_requirement,Not Provided,0,0,0,0,0,0,0,0,0
eAnci,EA32.txt,EA32.txt.actor,Started by Employee continued citizen,0,0,0,0,0,0,0,0,1
eAnci,EA32.txt,EA32.txt.flow_of_events.0,Employee views the notification received,1,0,0,0,1,1,0,0,1
eAnci,EA32.txt,EA32.txt.flow_of_events.1,The system shows the clerk the request for the creation of the ID card by by the citizen,1,1,1,1,1,1,0,0,0
eAnci,EA32.txt,EA32.txt.flow_of_events.2,The clerk detects an error in the data and rejects the ID card creation procedure,1,1,0,0,1,1,0,0,1
eAnci,EA32.txt,EA32.txt.flow_of_events.3,The system shall send an e-mail notification to the citizen who requested the ID card creation,1,1,1,0,1,1,0,0,0
eAnci,EA32.txt,EA32.txt.name,Request Card Of Identity Referred,1,1,1,1,1,1,0,0,0
eAnci,EA32.txt,EA32.txt.postcondition,The system notifies the citizen,1,0,1,0,1,1,0,0,0
eAnci,EA32.txt,EA32.txt.precondition,The employee has authenticated into the system This use case extends Request Identity Card and occurs when the clerk does not confirm the citizen 's request,0,0,0,0,0,0,0,0,1
eAnci,EA32.txt,EA32.txt.quality_requirement,Not Provided,0,0,0,0,0,0,0,0,0
eAnci,EA33.txt,EA33.txt.actor,Initiated by citizen,0,0,0,0,0,0,0,0,1
eAnci,EA33.txt,EA33.txt.flow_of_events.0,Citizen selects a specific certificate birth certificates marital status certificates,1,1,0,0,1,1,0,0,1
eAnci,EA33.txt,EA33.txt.flow_of_events.1,The system displays the form for entering the data of the person concerned,1,1,1,0,1,1,0,0,0
eAnci,EA33.txt,EA33.txt.flow_of_events.2,The citizen enters the data of the person concerned,1,0,0,0,1,1,0,0,1
eAnci,EA33.txt,EA33.txt.flow_of_events.3,The system displays a screen with the requested certificate,1,1,1,0,1,1,0,0,0
eAnci,EA33.txt,EA33.txt.flow_of_events.4,The citizen selects the payment and shipping method,1,0,0,0,1,1,0,0,1
eAnci,EA33.txt,EA33.txt.flow_of_events.5,The system sends the certificate,1,1,1,1,1,1,0,0,0
eAnci,EA33.txt,EA33.txt.name,Request Certificates,1,1,1,1,1,1,0,0,0
eAnci,EA33.txt,EA33.txt.postcondition,The system sends the certificate OR In the case where the relevant person has not been found the system calls the use case Data Errati OR In the case where the service is not available the use case Service Not Available is called,1,0,1,1,1,1,0,0,0
eAnci,EA33.txt,EA33.txt.precondition,The citizen has authenticated in the system,0,0,0,0,0,0,0,0,1
