ProjectID,file,ID,text,functional,Function,Behavior,Data,OnlyF,F,OnlyQ,Q,UserRelated
eAnci,EA112.txt,EA112.txt.flow_of_events.1,The system responds to the Citizen 's request by providing a detailed explanation of what this use case means in practical terms and distributing advice and standard procedures in case of hazards,1,1,1,0,1,1,0,0,0
eAnci,EA112.txt,EA112.txt.name,Sanitary Antropic,1,1,1,0,1,1,0,0,0
eAnci,EA112.txt,EA112.txt.postcondition,The Citizen is satisfied with the information provided to him OR The Citizen is unable to view the descriptive screen so the use case Service Not Available which handles technical failure cases will be extended,1,0,0,0,1,1,0,0,1
eAnci,EA112.txt,EA112.txt.precondition,The Citizen is authenticated in the municipal system OR The Citizen has accessed the municipal system,0,0,0,0,0,0,0,0,1
eAnci,EA112.txt,EA112.txt.quality_requirement,The system will respond to the Citizen 's need by responding with the descriptive page on the order of hundredths of a second OR If the Citizen can not view the screen the response from the system will increase in the order of seconds,0,0,0,0,0,0,1,1,1
eAnci,EA113.txt,EA113.txt.actor,Initiated by Citizen,0,0,0,0,0,0,0,0,1
eAnci,EA113.txt,EA113.txt.flow_of_events.0,The Citizen accesses this section to get information about his or her service to others,1,1,0,0,1,1,0,0,1
eAnci,EA113.txt,EA113.txt.flow_of_events.1,The system responds with a screen display where it clarifies the goals of community service general information and the ability to call Download Iscrizione use case,1,1,1,0,1,1,0,0,0
eAnci,EA113.txt,EA113.txt.name,Service Civil,1,1,1,0,1,1,0,0,0
eAnci,EA113.txt,EA113.txt.postcondition,The Citizen acknowledges the information received OR The Citizen fails to view the information page and therefore the use case Service Not Available which handles technical failure cases is extended,1,0,0,0,1,1,0,0,1
eAnci,EA113.txt,EA113.txt.precondition,The Citizen is authenticated in the municipal system OR The Citizen has accessed the municipal system,0,0,0,0,0,0,0,0,1
eAnci,EA113.txt,EA113.txt.quality_requirement,The response time is in the hundredths of a second range if the user is able to view the information page with its link to the form download OR The system 's response time to the Citizen 's need increases in the order of seconds if heshe fails to view the form,0,0,0,0,0,0,1,1,1
eAnci,EA114.txt,EA114.txt.actor,Initiated by Citizen,0,0,0,0,0,0,0,0,1
eAnci,EA114.txt,EA114.txt.flow_of_events.0,The Citizen accesses the descriptive screen of how the seismic monitoring of the territory takes place and the possibility of acquiring information about the causes of an earthquake and the measurement and prevention technologies used by the specialists of the operational core,1,1,0,0,1,1,0,0,1
eAnci,EA114.txt,EA114.txt.flow_of_events.1,The system shall respond by providing the Citizen with the opportunity to view in a always descriptive manner the characteristics of the instruments the work done by the specialists and the national agencies with which they collaborate,1,1,1,0,1,1,0,0,0
eAnci,EA114.txt,EA114.txt.name,Seismic,1,1,1,0,1,1,0,0,0
eAnci,EA114.txt,EA114.txt.postcondition,The Citizen is satisfied with the information retrieved put a available from the Civil Defense OR The Citizen is unable to obtain the descriptive screen and therefore the use case Service Not Available is extended which handles cases of technical failure,1,0,0,0,1,1,0,0,1
eAnci,EA114.txt,EA114.txt.precondition,The Citizen is authenticated in the municipal system OR The Citizen has accessed the municipal system,0,0,0,0,0,0,0,0,1
eAnci,EA114.txt,EA114.txt.quality_requirement,The system 's reaction time to the Citizen 's request is in the hundredths of a second range if the display is successful OR If the Citizen fails to display the information card correctly the system will respond in to seconds,0,0,0,0,0,0,1,1,1
eAnci,EA115.txt,EA115.txt.actor,Citizen User Registered,0,0,0,0,0,0,0,0,1
eAnci,EA115.txt,EA115.txt.flow_of_events.0,The Citizen accesses this tab in order to become personally aware of the environmental situation in the municipality where he or she resides whether it is being kept under control and what values are at risk and why this is so,1,1,0,0,1,1,0,0,1
eAnci,EA115.txt,EA115.txt.flow_of_events.1,The system responds with a descriptive screen about the toxicological values received from the chemical and toxicological analyses carried out by the Civil Defense on the environment and municipal land,1,1,1,1,1,1,0,0,0
eAnci,EA115.txt,EA115.txt.name,View Results Toxicological Environmental,1,1,1,1,1,1,0,0,0
eAnci,EA115.txt,EA115.txt.postcondition,The Citizen is satisfied with the information collected OR The Citizen is unable to view the card and therefore the use case Service Not Available which handles technical failure cases is extended,1,0,0,0,1,1,0,0,1
eAnci,EA115.txt,EA115.txt.precondition,The Citizen is authenticated in the municipal system OR The Citizen has accessed the municipal system,0,0,0,0,0,0,0,0,1
eAnci,EA115.txt,EA115.txt.quality_requirement,System response times are acceptable and on the order of hundredths of a second if the card is correctly displayed by the person who requested it Whereas if there was some hiccup in the display of the use case the system response times increase on the order of seconds from a minimum of to a maximum of,0,0,0,0,0,0,1,1,0
eAnci,EA116.txt,EA116.txt.actor,Started by Citizen,0,0,0,0,0,0,0,0,1
eAnci,EA116.txt,EA116.txt.flow_of_events.0,The Citizen accesses the introductory screen,1,1,0,0,1,1,0,0,1
eAnci,EA116.txt,EA116.txt.flow_of_events.1,The system responds by displaying the descriptive tab about the general information about this aspect of Civil Defense and the possibility of knowing the prerequisites for participation,1,1,1,0,1,1,0,0,0
eAnci,EA116.txt,EA116.txt.flow_of_events.2,The Citizen becomes aware of what is written and therefore selects the link where the use case Come Become Volunteer is called,1,1,0,0,1,1,0,0,1
eAnci,EA116.txt,EA116.txt.flow_of_events.3,The system responds by allowing him to view this description,1,0,1,0,1,1,0,0,0
eAnci,EA116.txt,EA116.txt.name,Volunteerism,1,1,1,0,1,1,0,0,0
eAnci,EA116.txt,EA116.txt.postcondition,The Citizen acknowledges the information received and if heshe agrees to call the case How To Become Volunteer redirected to that card OR The Citizen acknowledges of use comes of the information provided to him but exits the display of the current screen OR The Citizen fails to view the tab describing the Volunteer use case and therefore extends the Service Not Available use case that handles Technical Failure cases,1,0,0,0,1,1,0,0,1
eAnci,EA116.txt,EA116.txt.precondition,The Citizen is authenticated in the municipal system OR The Citizen has accessed the municipal system,0,0,0,0,0,0,0,0,1
eAnci,EA116.txt,EA116.txt.quality_requirement,System response times are in the hundredths of a second range if the Citizen is able to view the page correctly System response times to the Citizen 's request increase in the order of seconds varying from a minimum of to a maximum of,0,0,0,0,0,0,1,1,1
eAnci,EA117.txt,EA117.txt.actor,Started by Citizen,0,0,0,0,0,0,0,0,1
eAnci,EA117.txt,EA117.txt.flow_of_events.0,The Citizen accesses this tab from the Risks use case if they want to know more about the volcanic situation in their municipality and the ability to view the Civil Defense monitoring methods,1,1,0,0,1,1,0,0,1
eAnci,EA117.txt,EA117.txt.flow_of_events.1,The system responds with the correct display of a descriptive screen about the different types of eruptions of a volcano making available the possibility to view the current volcanic situation of the municipality,1,1,1,1,1,1,0,0,0
eAnci,EA117.txt,EA117.txt.flow_of_events.2,The Citizen wants to know how the present volcanoes are monitored and therefore will invoke the use case Monitor Vulcanic,1,1,0,0,1,1,0,0,1
eAnci,EA117.txt,EA117.txt.flow_of_events.3,The system provides the Citizen with a link to the Monitor Vulcanic use case so that they can learn about the actual situation,1,1,1,0,1,1,0,0,1
eAnci,EA117.txt,EA117.txt.name,Volcanic,1,1,1,1,1,1,0,0,0
eAnci,EA117.txt,EA117.txt.postcondition,The Citizen is satisfied with the information provided to himher OR The Citizen is unable to view the descriptive sheet of the Vulcan feature so the Service Not Available use case is extended which handles cases of technical failure,1,0,0,0,1,1,0,0,1
eAnci,EA117.txt,EA117.txt.precondition,The Citizen is authenticated in the municipal system OR The Citizen has accessed the municipal system,0,0,0,0,0,0,0,0,1
eAnci,EA117.txt,EA117.txt.quality_requirement,System response time is in the hundredths of a second range if the Citizen correctly displays the card with inherent components The response time to the requested service changes if the Citizen fails to properly view the descriptive page,0,0,0,0,0,0,1,1,1
eAnci,EA118.txt,EA118.txt.actor,Started by Citizen,0,0,0,0,0,0,0,0,1
eAnci,EA118.txt,EA118.txt.flow_of_events.0,The Citizen presses the button related to the tax calculation function,1,1,0,0,1,1,0,0,1
eAnci,EA118.txt,EA118.txt.flow_of_events.1,The System presents the list of taxes and fees for which the amount can be calculated,1,1,1,1,1,1,0,0,0
eAnci,EA118.txt,EA118.txt.flow_of_events.2,The Citizen selects the tax of interest,1,0,0,0,1,1,0,0,1
eAnci,EA118.txt,EA118.txt.flow_of_events.3,The System shows a form to be filled in for calculation,1,1,1,0,1,1,0,0,0
eAnci,EA118.txt,EA118.txt.flow_of_events.4,The Citizen enters the necessary data,1,0,0,0,1,1,0,0,1
eAnci,EA118.txt,EA118.txt.flow_of_events.5,The System verifies the correctness of the data computes the amount and shows it to the Citizen,1,1,1,1,1,1,0,0,0
eAnci,EA118.txt,EA118.txt.name,Calculate Amount,1,1,1,1,1,1,0,0,0
eAnci,EA118.txt,EA118.txt.postcondition,The Citizen receives the information of interest OR In the event that there is an error in data entry or the amount can not be calculated the System calls the use case Calculate Import Unsuccessful OR In the case where there are errors in the data entered by the citizen the System calls the use case Data Errata OR In case there are generic errors the system calls the use case Service Not Available,1,0,1,1,1,1,0,0,1
eAnci,EA118.txt,EA118.txt.precondition,The Citizen must be connected to the system,0,0,0,0,0,0,0,0,1
eAnci,EA118.txt,EA118.txt.quality_requirement,None,0,0,0,0,0,0,0,0,0
eAnci,EA119.txt,EA119.txt.actor,Started by Citizen,0,0,0,0,0,0,0,0,1
eAnci,EA119.txt,EA119.txt.flow_of_events.0,The Citizen presses the button related to the tax calculation function,1,1,0,0,1,1,0,0,1
eAnci,EA119.txt,EA119.txt.flow_of_events.1,The System presents the list of taxes and fees for which the amount can be calculated,1,1,1,1,1,1,0,0,0
eAnci,EA119.txt,EA119.txt.flow_of_events.2,The Citizen selects the tax of interest,1,0,0,0,1,1,0,0,1
eAnci,EA119.txt,EA119.txt.flow_of_events.3,The System shows a form to be filled in for calculation,1,1,1,0,1,1,0,0,0
eAnci,EA119.txt,EA119.txt.flow_of_events.4,The Citizen enters the necessary data,1,0,0,0,1,1,0,0,1
eAnci,EA119.txt,EA119.txt.flow_of_events.5,The System verifies the correctness of the data but fails to perform the calculation notifying the user of the reason for failure,1,1,1,1,1,1,0,0,0
eAnci,EA119.txt,EA119.txt.name,Calculate Amount Not Result,1,1,1,1,1,1,0,0,0
eAnci,EA119.txt,EA119.txt.postcondition,The System notifies the error and resubmits the form to the Citizen,1,0,1,0,1,1,0,0,0
eAnci,EA119.txt,EA119.txt.precondition,This use case extends Calculate Import and is invoked when the Citizen enters incorrect data OR an error has occurred in the calculation of the amount,0,0,0,0,0,0,0,0,1
eAnci,EA119.txt,EA119.txt.quality_requirement,Not Provided,0,0,0,0,0,0,0,0,0
eAnci,EA120.txt,EA120.txt.actor,Started by Citizen,0,0,0,0,0,0,0,0,1
eAnci,EA120.txt,EA120.txt.flow_of_events.0,The Citizen clicks on the button to access the online fine management feature,1,1,0,0,1,1,0,0,1
eAnci,EA120.txt,EA120.txt.flow_of_events.1,The System redirects the Citizen to the desired section,1,1,1,0,1,1,0,0,0
eAnci,EA120.txt,EA120.txt.flow_of_events.2,The Citizen clicks on the button to pay fines online,1,1,0,0,1,1,0,0,1
eAnci,EA120.txt,EA120.txt.flow_of_events.3,The System searches for fines against the Citizen in the database for which payment has not yet been received,1,1,1,1,1,1,0,0,0
eAnci,EA120.txt,EA120.txt.flow_of_events.4,The Citizen selects the fine for which heshe wishes to make a dispute,1,0,0,0,1,1,0,0,1
eAnci,EA120.txt,EA120.txt.flow_of_events.5,The System displays all available information related to the fine as well as the form to be filled in for the dispute,1,1,1,1,1,1,0,0,0
eAnci,EA120.txt,EA120.txt.flow_of_events.6,The Citizen enters the necessary information,1,0,0,0,1,1,0,0,1
eAnci,EA120.txt,EA120.txt.flow_of_events.7,The System verifies that the information is correct forwards the dispute request to the appropriate person and notifies the Citizen,1,1,1,1,1,1,0,0,0
eAnci,EA120.txt,EA120.txt.name,Contesta Multa,1,1,1,1,1,1,0,0,0
eAnci,EA120.txt,EA120.txt.postcondition,This use case extends Payment Multe and is invoked when the Citizen clicks on the button related to disputing fines OR In case there are generic errors the system calls the use case Service Not Available,1,0,1,0,1,1,0,0,1
eAnci,EA120.txt,EA120.txt.precondition,The Citizen has authenticated in the system,0,0,0,0,0,0,0,0,1
eAnci,EA120.txt,EA120.txt.quality_requirement,Not Provided,0,0,0,0,0,0,0,0,0
eAnci,EA121.txt,EA121.txt.actor,Initiated by Citizen,0,0,0,0,0,0,0,0,1
eAnci,EA121.txt,EA121.txt.flow_of_events.0,The Citizen clicks on the button to access the Online Tax Payment area,1,1,0,0,1,1,0,0,1
eAnci,EA121.txt,EA121.txt.flow_of_events.1,The System displays the list of fees that can be paid online,1,1,1,1,1,1,0,0,0
eAnci,EA121.txt,EA121.txt.flow_of_events.2,The Citizen selects the section dedicated to Municipal Property Tax and its payment,1,0,0,0,1,1,0,0,1
eAnci,EA121.txt,EA121.txt.flow_of_events.3,The System redirects the Citizen to the necessary section showing the form of the relevant tax and the relevant amount to be paid,1,1,1,1,1,1,0,0,0
eAnci,EA121.txt,EA121.txt.flow_of_events.4,The Citizen confirms the correctness of the information and initiates the transaction selecting the preferred payment method,1,1,0,0,1,1,0,0,1
eAnci,EA121.txt,EA121.txt.flow_of_events.5,The System performs the transaction and displays a successful payment message,1,1,1,1,1,1,0,0,0
eAnci,EA121.txt,EA121.txt.name,ICI,1,1,1,1,1,1,0,0,0
eAnci,EA121.txt,EA121.txt.postcondition,Payment has been made OR In the case where there is insufficient funds to cover the payment or an error occurs in the transaction the System calls the case use case Payment Not Failed OR In the case where other generic System-related errors occur the use case is invoked Service Not Available,1,0,1,1,1,1,0,0,0
eAnci,EA121.txt,EA121.txt.precondition,The Citizen has authenticated in the system,0,0,0,0,0,0,0,0,1
eAnci,EA121.txt,EA121.txt.quality_requirement,Not Expected,0,0,0,0,0,0,0,0,0
eAnci,EA122.txt,EA122.txt.actor,Initiated by Citizen,0,0,0,0,0,0,0,0,1
eAnci,EA122.txt,EA122.txt.flow_of_events.0,The Citizen clicks on the button to access the Online Tax Payment area,1,1,0,0,1,1,0,0,1
eAnci,EA122.txt,EA122.txt.flow_of_events.1,The System displays the list of taxes that can be paid online,1,1,1,1,1,1,0,0,0
eAnci,EA122.txt,EA122.txt.flow_of_events.2,The Citizen selects the section on Advertising and Public Display Tax and its payment and enters the file code,1,0,0,0,1,1,0,0,1
eAnci,EA122.txt,EA122.txt.flow_of_events.3,The System redirects the Citizen to the necessary section showing the form of the relevant tax and the relevant amount to be paid,1,1,1,1,1,1,0,0,0
eAnci,EA122.txt,EA122.txt.flow_of_events.4,The Citizen confirms that the information is correct selects the preferred payment method and initiates the transaction,1,1,0,0,1,1,0,0,1
eAnci,EA122.txt,EA122.txt.flow_of_events.5,The System performs the transaction and displays a successful payment message,1,1,1,1,1,1,0,0,0
eAnci,EA122.txt,EA122.txt.name,IPPA,1,1,1,1,1,1,0,0,0
eAnci,EA122.txt,EA122.txt.postcondition,Payment has been made OR In the case where there is insufficient funds to cover the payment or an error occurs in the transaction the System calls the case use case Payment Not Received OR In the case where there are general errors the System calls the use case Service Not Available,1,0,1,1,1,1,0,0,0
eAnci,EA122.txt,EA122.txt.precondition,The Citizen has logged in The Citizen has made the request for the specific service The request for the service has been accepted,0,0,0,0,0,0,0,0,1
eAnci,EA122.txt,EA122.txt.quality_requirement,Not Provided,0,0,0,0,0,0,0,0,0
eAnci,EA123.txt,EA123.txt.actor,Initiated by Citizen,0,0,0,0,0,0,0,0,1
eAnci,EA123.txt,EA123.txt.flow_of_events.0,The Citizen clicks on the button to access the Online Tax Payment area,1,1,0,0,1,1,0,0,1
eAnci,EA123.txt,EA123.txt.flow_of_events.1,The System displays the list of fees that can be paid online,1,1,1,1,1,1,0,0,0
eAnci,EA123.txt,EA123.txt.flow_of_events.2,The Citizen selects the section dedicated to Income Tax for Individuals and its payment,1,0,0,0,1,1,0,0,1
eAnci,EA123.txt,EA123.txt.flow_of_events.3,The System redirects the Citizen to the necessary section showing the form of the relevant tax and the relevant amount to be paid,1,1,1,1,1,1,0,0,0
eAnci,EA123.txt,EA123.txt.flow_of_events.4,The Citizen confirms the correctness of the information selects the preferred payment method and initiates the transaction,1,1,0,0,1,1,0,0,1
eAnci,EA123.txt,EA123.txt.flow_of_events.5,The System performs the transaction and displays a successful payment message,1,1,1,1,1,1,0,0,0
eAnci,EA123.txt,EA123.txt.name,IRPEF,1,1,1,1,1,1,0,0,0
eAnci,EA123.txt,EA123.txt.postcondition,The payment has been made OR In the case where there is insufficient funds to cover the payment or an error occurs in the transaction the System calls the case use case Payment Not Successful OR In the case where additional generic problems arise the System calls the use case Service Not Available,1,0,1,1,1,1,0,0,0
eAnci,EA123.txt,EA123.txt.precondition,The Citizen has authenticated in the system,0,0,0,0,0,0,0,0,1
eAnci,EA123.txt,EA123.txt.quality_requirement,Not Provided,0,0,0,0,0,0,0,0,0
eAnci,EA124.txt,EA124.txt.actor,Initiated by Citizen,0,0,0,0,0,0,0,0,1
eAnci,EA124.txt,EA124.txt.flow_of_events.0,Citizen clicks button to access forms section,1,1,0,0,1,1,0,0,1
eAnci,EA124.txt,EA124.txt.flow_of_events.1,The System redirects the Citizen to the required section and displays the various forms available for download,1,1,1,0,1,1,0,0,0
eAnci,EA124.txt,EA124.txt.flow_of_events.2,The Citizen selects the desired form,1,0,0,0,1,1,0,0,1
eAnci,EA124.txt,EA124.txt.flow_of_events.3,The System starts the download,1,1,1,0,1,1,0,0,0
eAnci,EA124.txt,EA124.txt.name,Forms,1,1,1,0,1,1,0,0,0
eAnci,EA124.txt,EA124.txt.postcondition,The download has been initialized OR In case there are general errors the system calls the use case Service Not Available,1,0,1,0,1,1,0,0,1
eAnci,EA124.txt,EA124.txt.precondition,The Citizen is logged in,0,0,0,0,0,0,0,0,1
eAnci,EA124.txt,EA124.txt.quality_requirement,Not expected,0,0,0,0,0,0,0,0,0
eAnci,EA125.txt,EA125.txt.actor,Started by Citizen,0,0,0,0,0,0,0,0,1
eAnci,EA125.txt,EA125.txt.flow_of_events.0,The Citizen clicks on the button to access the online fines management feature,1,1,0,0,1,1,0,0,1
eAnci,EA125.txt,EA125.txt.flow_of_events.1,The System redirects the Citizen to the desired section,1,1,1,0,1,1,0,0,0
eAnci,EA125.txt,EA125.txt.flow_of_events.2,The Citizen clicks on the button to pay fines online,1,0,0,0,1,1,0,0,1
eAnci,EA125.txt,EA125.txt.flow_of_events.3,The System searches for fines against the Citizen in the database for which payment has not yet been received,1,1,1,1,1,1,0,0,0
eAnci,EA125.txt,EA125.txt.flow_of_events.4,The Citizen selects the fine for which heshe wishes to make payment,1,0,0,0,1,1,0,0,1
eAnci,EA125.txt,EA125.txt.flow_of_events.5,The System displays the fine form and the relevant amount to be paid,1,1,1,1,1,1,0,0,0
eAnci,EA125.txt,EA125.txt.flow_of_events.6,The Citizen verifies that the information is correct and initiates the transaction selecting the preferred payment method,1,1,0,0,1,1,0,0,1
eAnci,EA125.txt,EA125.txt.flow_of_events.7,The System performs the transaction and displays a successful payment message,1,1,1,1,1,1,0,0,0
eAnci,EA125.txt,EA125.txt.name,Payment Fees,1,1,1,1,1,1,0,0,0
eAnci,EA125.txt,EA125.txt.postcondition,The payment has been made OR In case there is an error in data entry or the available funds are not sufficient to cover the payment the System calls the use case Payment Not Received OR The Citizen clicks on the button related to dispute a particular fine in which case the System calls the use case Contesta Multa OR In the case where there are errors in the data entered by the Citizen the System calls the use case Dati Errati OR In the case where there are generic errors the system calls the use case Service Not Available,1,0,1,1,1,1,0,0,1
eAnci,EA125.txt,EA125.txt.precondition,The Citizen has authenticated in the system,0,0,0,0,0,0,0,0,1
eAnci,EA125.txt,EA125.txt.quality_requirement,None,0,0,0,0,0,0,0,0,0
eAnci,EA126.txt,EA126.txt.actor,Started by Citizen,0,0,0,0,0,0,0,0,1
eAnci,EA126.txt,EA126.txt.flow_of_events.0,The Citizen clicks on the button to access the Online Payment area for taxes or fines,1,1,0,0,1,1,0,0,1
eAnci,EA126.txt,EA126.txt.flow_of_events.1,The System displays the list of feesfines that can be paid online,1,1,1,1,1,1,0,0,0
eAnci,EA126.txt,EA126.txt.flow_of_events.2,The Citizen selects the taxfine of interest,1,0,0,0,1,1,0,0,1
eAnci,EA126.txt,EA126.txt.flow_of_events.3,The System redirects the Citizen to the necessary section showing the form to the Citizen,1,1,1,0,1,1,0,0,0
eAnci,EA126.txt,EA126.txt.flow_of_events.4,The Citizen initiates the transaction,1,1,0,0,1,1,0,0,1
eAnci,EA126.txt,EA126.txt.flow_of_events.5,The System does not allow the transaction because there were problems with the selected payment method,1,0,1,0,1,1,0,0,0
eAnci,EA126.txt,EA126.txt.name,Payment Unsuccessful,1,1,1,1,1,1,0,0,0
eAnci,EA126.txt,EA126.txt.postcondition,s The System notifies the error and displays the form again for completion,1,0,1,0,1,1,0,0,0
eAnci,EA126.txt,EA126.txt.precondition,This use case extends ICI IRPEF TIA TOSAP IPPA and Payment Multa and is invoked when errors occur due to the payment method,0,0,0,0,0,0,0,0,0
eAnci,EA126.txt,EA126.txt.quality_requirement,Not provided,0,0,0,0,0,0,0,0,0
eAnci,EA127.txt,EA127.txt.actor,Started by Citizen,0,0,0,0,0,0,0,0,1
eAnci,EA127.txt,EA127.txt.flow_of_events.0,The Citizen clicks on the button to access the online fines management feature,1,1,0,0,1,1,0,0,1
eAnci,EA127.txt,EA127.txt.flow_of_events.1,The System redirects the Citizen to the desired section,1,1,1,0,1,1,0,0,0
eAnci,EA127.txt,EA127.txt.flow_of_events.2,The Citizen clicks on the button to search for fines only charged to himher,1,0,0,0,1,1,0,0,1
eAnci,EA127.txt,EA127.txt.flow_of_events.3,The System searches the citizen 's charge fines paid and unpaid in the database and displays them in a list in which you can browse to show all the information available for a given fine,1,1,1,1,1,1,0,0,0
eAnci,EA127.txt,EA127.txt.name,Search Verbals Multices,1,1,1,1,1,1,0,0,0
eAnci,EA127.txt,EA127.txt.postcondition,The System has performed the search OR In case there are generic errors the system calls the use case Service Not Available,1,0,1,0,1,1,0,0,0
eAnci,EA127.txt,EA127.txt.precondition,The Citizen has authenticated into the system,0,0,0,0,0,0,0,0,1
eAnci,EA127.txt,EA127.txt.quality_requirement,Not expected,0,0,0,0,0,0,0,0,0
eAnci,EA128.txt,EA128.txt.actor,Initiated by Citizen communicates with Employee,0,0,0,0,0,0,0,0,1
eAnci,EA128.txt,EA128.txt.flow_of_events.0,The Citizen clicks on the button to access the municipality 's service request area,1,1,0,0,1,1,0,0,1
eAnci,EA128.txt,EA128.txt.flow_of_events.1,The System redirects the Citizen to the required section,1,1,1,0,1,1,0,0,0
eAnci,EA128.txt,EA128.txt.flow_of_events.2,The Citizen selects the section dedicated to the Advertising and Public Display Tax request,1,1,0,0,1,1,0,0,1
eAnci,EA128.txt,EA128.txt.flow_of_events.3,The System displays the relevant request form automatically obtaining the necessary data,1,1,1,0,1,1,0,0,0
eAnci,EA128.txt,EA128.txt.flow_of_events.4,The Citizen enters additional data necessary for correct completion of the form confirms the correctness of the information and sends the request,1,0,0,1,1,1,0,0,1
eAnci,EA128.txt,EA128.txt.flow_of_events.5,The System notifies the employee of the request,1,1,1,0,1,1,0,0,0
eAnci,EA128.txt,EA128.txt.name,Request IPPA,1,1,1,1,1,1,0,0,0
eAnci,EA128.txt,EA128.txt.postcondition,The clerk receives the file and chooses whether to accept it or not invoking the use case respectively Request IPPA Accepted Request IPPA Rified OR In case there are errors in the data o entered by the user the system calls the use case Data Errred,1,0,1,1,1,1,0,0,1
eAnci,EA128.txt,EA128.txt.precondition,The Citizen has authenticated in the system,0,0,0,0,0,0,0,0,1
eAnci,EA128.txt,EA128.txt.quality_requirement,Not expected,0,0,0,0,0,0,0,0,0
eAnci,EA129.txt,EA129.txt.actor,Started by Employee,0,0,0,0,0,0,0,0,1
eAnci,EA129.txt,EA129.txt.flow_of_events.0,The Employee displays the notification received,1,1,0,0,1,1,0,0,1
eAnci,EA129.txt,EA129.txt.flow_of_events.1,The System displays to the Clerk the request made by the citizen,1,1,1,1,1,1,0,0,0
eAnci,EA129.txt,EA129.txt.flow_of_events.2,The Clerk certifies the validity of the request by checking the accuracy of the data and enables the bureaucratic procedure for requesting the service,1,1,0,0,1,1,0,0,1
eAnci,EA129.txt,EA129.txt.flow_of_events.3,The System sends a confirmation e-mail to the citizen who requested the service,1,1,1,0,1,1,0,0,0
eAnci,EA129.txt,EA129.txt.name,Request IPPA Accepted,1,1,1,1,1,1,0,0,0
