ProjectID,file,ID,text,functional,Function,Behavior,Data,OnlyF,F,OnlyQ,Q,UserRelated
1,promise_reclass.csv,,The system shall refresh the display every 60 seconds.,1,0,1,0,0,1,0,1,0
1,promise_reclass.csv,,The application shall match the color of the schema set forth by Department of Homeland Security,0,0,0,0,0,0,1,1,0
1,promise_reclass.csv,,If projected the data must be readable. On a 10x10 projection screen 90% of viewers must be able to read Event / Activity data from a viewing distance of 30,0,0,0,0,0,0,1,1,0
1,promise_reclass.csv,,The product shall be available during normal business hours. As long as the user has access to the client PC the system will be available 99% of the time during the first six months of operation.,0,0,0,0,0,0,1,1,0
1,promise_reclass.csv,,If projected the data must be understandable. On a 10x10 projection screen 90% of viewers must be able to determine that Events or Activities are occuring in current time from a viewing distance of 100,0,0,0,0,0,0,1,1,0
1,promise_reclass.csv,,The product shall ensure that it can only be accessed by authorized users. The product will be able to distinguish between authorized and unauthorized users in all access attempts,1,1,1,0,0,1,0,1,0
1,promise_reclass.csv,,The product shall be intuitive and self-explanatory. : 90% of new users shall be able to start the display of Events or Activities within 90 minutes of using the product.,0,0,0,0,0,0,1,1,0
1,promise_reclass.csv,,The product shall respond fast to keep up-to-date data in the display.,0,0,0,0,0,0,1,1,0
1,promise_reclass.csv,,The system shall have a MDI form that allows for the viewing of the graph and the data table.,1,0,0,1,1,1,0,0,0
1,promise_reclass.csv,,The system shall display Events in a vertical table by time.,1,1,0,0,1,1,0,0,0
1,promise_reclass.csv,,The system shall display the Events in a graph by time.,1,1,0,0,1,1,0,0,0
1,promise_reclass.csv,,The system shall display Events or Activities.,1,1,0,0,1,1,0,0,0
1,promise_reclass.csv,,The display shall have two regions: left 2/3 of the display is graphical right 1/3 of the display is a data table,0,0,0,0,0,0,1,1,0
1,promise_reclass.csv,,The data displayed in both the nodes within the graph and the rows in the table are MSEL Summary data,0,0,0,0,0,0,0,0,0
1,promise_reclass.csv,,The table side of the display shall be split into 2 regions: sequential and temporal.,0,0,0,0,0,0,1,1,0
1,promise_reclass.csv,,The top 1/4 of the table will hold events that are to occur sequentially.,1,0,0,1,0,1,0,1,0
1,promise_reclass.csv,,The bottom 3/4 of the table will hold events that occur according to its relevance to current time.,1,0,0,1,0,1,0,1,0
1,promise_reclass.csv,,The system shall color code events according to their variance from current time.,1,1,0,0,0,1,0,1,0
1,promise_reclass.csv,,The system shall display data from the Sync Matrix 1.0 and Exercise Management Tool 1.0 applications,1,1,0,0,0,1,0,1,0
1,promise_reclass.csv,,The system shall link Events back to either the Sync Matrix 1.0 or the Exercise Managment Tool 1.0 applications for modifications.,1,1,0,0,0,1,0,1,0
1,promise_reclass.csv,,The system shall allow modification of the display.,1,1,0,0,1,1,0,0,0
1,promise_reclass.csv,,The system shall offer a display of all the Events in the exercise.,1,0,0,1,1,1,0,0,0
1,promise_reclass.csv,,The system shall filter data by: Venues and Key Events.,1,1,0,0,1,1,0,0,0
1,promise_reclass.csv,,The system shall allow a user to define the time segments,1,1,0,0,1,1,0,0,0
1,promise_reclass.csv,,The system shall display the local and exercise time in separate clocks,1,1,0,0,1,1,0,0,0
1,promise_reclass.csv,,The system shall offer the ability to pause and resume the refresh of data.,1,1,0,0,1,1,0,0,0
1,promise_reclass.csv,,The system shall provide charts for the Activity or Event actual versus assumed time.,1,1,0,1,1,1,0,0,0
1,promise_reclass.csv,,The system shall provide a history report of changes made to the Activity or Event data,1,1,0,1,1,1,0,0,0
2,promise_reclass.csv,,The look and feel of the system shall conform to the user interface standards of the smart device.,0,0,0,0,0,0,1,1,0
2,promise_reclass.csv,,The user interface shall have standard menus buttons for navigation,0,0,0,0,0,0,1,1,0
2,promise_reclass.csv,,The system shall have a professional appearance,0,0,0,0,0,0,1,1,0
2,promise_reclass.csv,,The product shall have a consistent color scheme and fonts.,0,0,0,0,0,0,1,1,0
2,promise_reclass.csv,,The system shall be used by realtors with no training.,0,0,0,0,0,0,1,1,0
2,promise_reclass.csv,,The system shall be intuitive and self explanatory.,0,0,0,0,0,0,1,1,0
2,promise_reclass.csv,,The product shall be easy for a realtor to learn.,0,0,0,0,0,0,1,1,0
2,promise_reclass.csv,,The product shall use symbols and words that are naturally understandable by the realtor community.,0,0,0,0,0,0,1,1,0
2,promise_reclass.csv,,The product shall produce search results in an acceptable time,1,1,0,0,0,1,0,1,0
2,promise_reclass.csv,,The search results shall be returned no later 30 seconds after the user has entered the search criteria,1,0,1,0,0,1,0,1,0
2,promise_reclass.csv,,The product shall generate a CMA report in an acceptable time.,1,1,0,0,0,1,0,1,0
2,promise_reclass.csv,,The CMA report shall be returned no later 60 seconds after the user has entered the CMA report criteria.,1,0,1,0,0,1,0,1,0
2,promise_reclass.csv,,The product shall synchronize contacts and appointments in an acceptable time.,1,1,0,0,0,1,0,1,0
2,promise_reclass.csv,,The product shall synchronize with the office system every hour.,1,0,1,0,0,1,0,1,0
2,promise_reclass.csv,,The product shall be available for use 24 hours per day 365 days per year,0,0,0,0,0,0,1,1,0
2,promise_reclass.csv,,Out of 1000 accesses to the system the system is available 999 times.,0,0,0,0,0,0,1,1,0
2,promise_reclass.csv,,The product shall operate in offline mode whenever internet connection is unavailable.,0,0,0,0,0,0,1,1,0
2,promise_reclass.csv,,The product shall allow the user to view previously downloaded search results CMA reports and appointments.,1,1,0,0,1,1,0,0,0
2,promise_reclass.csv,,The product shall retain user preferences in the event of a failure.,1,0,1,1,1,1,0,0,0
2,promise_reclass.csv,,100% of saved user preferences shall be restored when system comes back online.,1,0,1,1,0,1,0,1,0
2,promise_reclass.csv,,The product shall be able to support multiple remote users,1,0,1,0,1,1,0,0,0
2,promise_reclass.csv,,The product shall be able support 1000 simultaneous users.,0,0,0,0,0,0,1,1,0
2,promise_reclass.csv,,The product shall be capable of handling the existing 1000 users. This number is expected to grow 5 times within the next year.,0,0,0,0,0,0,1,1,0
2,promise_reclass.csv,,The product shall be installed by an untrained realtor without recourse to separately-printed instructions.,0,0,0,0,0,0,1,1,0
2,promise_reclass.csv,,90% of untrained realtors shall be able to install the product on their device without printed instructions,0,0,0,0,0,0,1,1,0
2,promise_reclass.csv,,The product is expected to run on Windows CE and Palm operating systems.,0,0,0,0,0,0,1,1,0
2,promise_reclass.csv,,Only registered realtors shall be able to access the system.,0,0,0,0,0,0,1,1,0
2,promise_reclass.csv,,Every user of the system shall be authenticated and authorized.,1,1,0,0,0,1,0,1,0
2,promise_reclass.csv,,The product shall prevent its data from incorrect data being introduced.,0,0,0,0,0,0,1,1,0
2,promise_reclass.csv,,The system shall allow a real estate agent to query MLS information,1,1,0,0,1,1,0,0,0
2,promise_reclass.csv,,The user shall be able to get driving directions to a selected property,1,1,0,0,1,1,0,0,0
2,promise_reclass.csv,,The user shall be able to download appointments and contact information for clients,1,1,0,0,1,1,0,0,0
2,promise_reclass.csv,,The system shall display clear property images in the search results,1,0,1,1,1,1,0,0,0
2,promise_reclass.csv,,The system shall update or create new property listings in the MLS,1,1,0,0,1,1,0,0,0
2,promise_reclass.csv,,Realtor shall be able to generate a CMA report based on property criteria,1,1,0,0,1,1,0,0,0
2,promise_reclass.csv,,The system shall be able to call the seller or buyer to schedule an appointment,1,1,0,0,1,1,0,0,0
2,promise_reclass.csv,,The realtor shall be notified of new client appointments after automatic synchronization with office system,1,0,1,0,1,1,0,0,0
2,promise_reclass.csv,,The realtor shall be able to retrieve a map showing property locations for a specified area,1,1,0,0,1,1,0,0,0
2,promise_reclass.csv,,The system shall notify the realtor when a seller or buyer responds to an appointment request,1,0,1,0,1,1,0,0,0
2,promise_reclass.csv,,The product shall allow the user to save the property search results.,1,1,0,0,1,1,0,0,0
3,promise_reclass.csv,,The system shall be easy to use by the Program Administrators/Nursing Staff Members.,0,0,0,0,0,0,1,1,0
3,promise_reclass.csv,,All of the users shall be able to use the system after one day of training.,0,0,0,0,0,0,1,1,0
3,promise_reclass.csv,,The system shall help the user avoid making mistakes while scheduling classes and clinicals for the nursing students.,0,0,0,0,0,0,1,1,0
3,promise_reclass.csv,,The number of mistakes noted by the students shall be decreased by 50% in the first year.,0,0,0,0,0,0,1,1,0
3,promise_reclass.csv,,The system shall be intuitive to the Program Administrators/Nursing Staff Members.,0,0,0,0,0,0,1,1,0
3,promise_reclass.csv,,2 out of 3 Program Administrators/Nursing Staff Members shall successfully be able to use the system to manage the scheduling of classes and clinicals.,1,1,0,0,0,1,0,1,0
3,promise_reclass.csv,,The system shall use symbols and words that are naturally understandable by the user community.,0,0,0,0,0,0,1,1,0
3,promise_reclass.csv,,The verbiage used within the system shall be consistent with Standard English and the terminology of the national Nursing Community.,0,0,0,0,0,0,1,1,0
3,promise_reclass.csv,,Staff members shall be able to complete a set of tasks in a timely manner.,0,0,0,0,0,0,1,1,0
3,promise_reclass.csv,,The response time of general student management tasks shall take no longer than 5 seconds and the response time of schedule generation shall take no longer than 30 seconds.,0,0,0,0,0,0,1,1,0
3,promise_reclass.csv,,The system shall be available for use between the hours of 8am and 6pm.,0,0,0,0,0,0,1,1,0
3,promise_reclass.csv,,The system shall achieve 95% up time.,0,0,0,0,0,0,1,1,0
3,promise_reclass.csv,,system shall be able to handle all of the user requests/usage during business hours.,0,0,0,0,0,0,1,1,0
3,promise_reclass.csv,,The system shall cater to 10 simultaneous users from 9am to 5pm.,0,0,0,0,0,0,1,1,0
3,promise_reclass.csv,,The system shall be capable of processing 100% of nursing students and their classes for the next 10 years.,0,0,0,0,0,0,1,1,0
3,promise_reclass.csv,,The system shall be expected to manage the nursing program curriculum and class/clinical scheduling for a minimum of 5 years.,1,1,0,0,0,1,0,1,0
3,promise_reclass.csv,,The system shall able to operate within a business office environment typical of the Nursing Department at DePaul University.,0,0,0,0,0,0,1,1,0
3,promise_reclass.csv,,The system shall be used within the specifications defined by the computers used by the Program Administrators/Nursing Staff Members.,0,0,0,0,0,0,1,1,0
3,promise_reclass.csv,,The system shall operate within the Windows XP Professional operating system.,0,0,0,0,0,0,1,1,0
3,promise_reclass.csv,,The system shall interface with CampusConnect’s central server,0,0,0,0,0,0,1,1,0
3,promise_reclass.csv,,The system shall interface with the faculty central server.,0,0,0,0,0,0,1,1,0
3,promise_reclass.csv,,The system shall interface with the student master server.,0,0,0,0,0,0,1,1,0
3,promise_reclass.csv,,We must be able to interface with any HTML browser.,0,0,0,0,0,0,1,1,0
3,promise_reclass.csv,,Only authorized users shall have access to clinical site information.,0,0,0,0,0,0,1,1,0
3,promise_reclass.csv,,Program Administrators/Nursing Staff Members are the only people who shall have access to clinical site details.,0,0,0,0,0,0,1,1,0
3,promise_reclass.csv,,Only authorized users shall have access to students’ personal information.,0,0,0,0,0,0,1,1,0
3,promise_reclass.csv,,Dr Susan Poslusny and Dr Julie Donalek are the only people who shall have access to students’ personal information.,0,0,0,0,0,0,1,1,0
3,promise_reclass.csv,,Only authorized users shall have access to the portion of the system that interfaces with CampusConnect.,0,0,0,0,0,0,1,1,0
3,promise_reclass.csv,,Fit Criterion: Dr Susan Poslusny and Karen Sysol are the only people who shall have access to the final class section scheduling for the system that interfaces with CampusConnect.,0,0,0,0,0,0,1,1,0
3,promise_reclass.csv,,The system shall have basic data integrity checking to reduce the possibility of incorrect or invalid data being introduced.,1,1,0,0,0,1,0,1,0
3,promise_reclass.csv,,The system shall protect private information in accordance with the organization’s information policy.,1,1,0,0,0,1,0,1,0
3,promise_reclass.csv,,The system shall be built such that it is as secure as possible from malicious interference.,0,0,0,0,0,0,1,1,0
3,promise_reclass.csv,,The system shall use the organization’s standard virus protection software to help monitor threats to itself.,0,0,0,0,0,0,1,1,0
3,promise_reclass.csv,,A cohort shall be associated to one Program of Study offered by the department.,1,0,0,1,1,1,0,0,0
3,promise_reclass.csv,,Program Administrators and Nursing Staff Members shall be able to add a listing of students to a cohort.,1,1,0,0,1,1,0,0,0
3,promise_reclass.csv,,Program Administrators and Nursing Staff Members shall be able to add a single student to a cohort,1,1,0,0,1,1,0,0,0
3,promise_reclass.csv,,Students added to a cohort shall be eligible for the cohort’s Program of Study.,1,0,1,0,1,1,0,0,0
3,promise_reclass.csv,,Program Administrators and Nursing Staff Members shall be able to specify the preferred sequence of classes for a given cohort.,1,1,0,0,1,1,0,0,0
3,promise_reclass.csv,,For each class within a sequence for a cohort Program Administrators and Nursing Staff Members shall be able to specify which quarter that class will be offered.,1,1,0,1,1,1,0,0,0
3,promise_reclass.csv,,Program Administrators and Nursing Staff Members shall be able to add new classes to a sequence of classes,1,1,0,0,1,1,0,0,0
3,promise_reclass.csv,,Program Administrators and Nursing Staff Members shall be able to add clinical classes or sections to a sequence of classes,1,1,0,0,1,1,0,0,0
3,promise_reclass.csv,,Program Administrators and Nursing Staff Members shall be able to add a new cohort to the system identified by start month and year.,1,1,0,0,1,1,0,0,0
3,promise_reclass.csv,,Program Administrators and Nursing Staff Members shall be able to add new classes for the nursing department into the system.,1,1,0,0,1,1,0,0,0
3,promise_reclass.csv,,A class shall be either a non-clinical class or a clinical class.,0,0,0,0,0,0,0,0,0
3,promise_reclass.csv,,A non-clinical class shall specify the course name lecture room requirements and instructor needs.,0,0,0,0,0,0,0,0,0
3,promise_reclass.csv,,A clinical class shall specify the course name lecture room requirements clinical site needs lecture instructor needs and clinical lab instructor needs.,0,0,0,0,0,0,0,0,0
3,promise_reclass.csv,,Program Administrators/Nursing Staff Members shall be able to create a new Program of Study.,1,1,0,0,1,1,0,0,0
3,promise_reclass.csv,,A Program of Study shall consist of a program name and listing of required classes (both clinical and non-clinical) that must be completed.,0,0,0,0,0,0,0,0,0
3,promise_reclass.csv,,Program Administrators and Nursing Staff Members shall have the ability to specify which classes are required for a Program of Study,1,1,0,0,1,1,0,0,0
3,promise_reclass.csv,,The system shall be able to display a report of needed classes for a given quarter for all cohorts of all programs for Program Administrators/Nursing Staff Members’ planning purposes.,1,1,0,0,1,1,0,0,0
3,promise_reclass.csv,,The report of needed classes shall include (but not be limited to) classes to be offered number of sections needed number of labs needed and room types needed.,1,0,0,1,1,1,0,0,0
3,promise_reclass.csv,,Classes for a given cohort shall not conflict with regards to the time and day that they are offered.,1,0,1,0,1,1,0,0,0
3,promise_reclass.csv,,Program Administrators and Nursing Staff Members shall be able to add a new clinical site into the system.,1,1,0,0,1,1,0,0,0
3,promise_reclass.csv,,Clinical site information shall include (but not be limited to) the name of the site contact person and contact information.,0,0,0,0,0,0,0,0,0
3,promise_reclass.csv,,Program Administrators and Nursing Staff Members shall be able to add a new clinical lab section for an existing clinical class into the System.,1,1,0,0,1,1,0,0,0
3,promise_reclass.csv,,A clinical lab section shall include the clinical site name the class instructor day and time of the lab.,0,0,0,0,0,0,0,0,0
3,promise_reclass.csv,,Program Administrators and Nursing Staff Members shall be able to add a student who has registered for a clinical class to a clinical lab section for that class.,1,1,0,0,1,1,0,0,0
3,promise_reclass.csv,,The system shall allow a Program Administrator or Nursing staff member to remove a student from a clinical lab section.,1,1,0,0,1,1,0,0,0
3,promise_reclass.csv,,The system shall allow a Program Administrator/Nursing Staff Member to move a student from one clinical lab section to another clinical lab section corresponding to the same clinical class.,1,1,0,0,1,1,0,0,0
3,promise_reclass.csv,,Program Administrators/Nursing Staff Members shall be able to cancel a clinical lab section only if there are no students registered for that clinical lab section.,1,1,1,0,1,1,0,0,0
3,promise_reclass.csv,,A Program Administrator/Nursing Staff Member shall be able to add a new nursing student to the system.,1,1,0,0,1,1,0,0,0
3,promise_reclass.csv,,A staff member shall have the ability to manage the progress of a part time student which includes modifying their sequence of classes and timeline of classes.,1,1,0,0,1,1,0,0,0
3,promise_reclass.csv,,The system shall be able to display a printable summary for individual cohorts which will include the students enlisted the Program of study sequence of classes cohort progress through the program and timeline of completion.,1,1,0,1,1,1,0,0,0
3,promise_reclass.csv,,The system shall be able to display a printable summary for individual clinical sites which will include information on labs being held at that site for the given quarter (Clinical site general information on labs held at that location dates and times of all labs held there).,1,1,0,1,1,1,0,0,0
3,promise_reclass.csv,,The system shall be able to display a printable summary for individual clinical labs which will include (but not be limited to) class name class number lab section listing of students enrolled instructor day(s) time and location.,1,1,0,1,1,1,0,0,0
3,promise_reclass.csv,,The system shall be able to display a printable summary for individual nursing students which will include (but not be limited to) student name student ID admission date classes credits GPA and the cohort that the student is enrolled in.,1,1,0,1,1,1,0,0,0
3,promise_reclass.csv,,The system shall be able to display a printable summary of the system log.,1,1,0,0,1,1,0,0,0
3,promise_reclass.csv,,The system shall contain contact information (e-mail and phone number) for all people relevant to the system including (but not limited to) staff members students lecture instructors clinical lab instructors and clinical site administrators.,1,0,0,1,1,1,0,0,0
3,promise_reclass.csv,,The system will use the stored e-mail addresses as a primary means of communicating information to affected parties.,1,0,1,0,1,1,0,0,0
3,promise_reclass.csv,,The system will notify affected parties for routine communication purposes including but not limited to informing students of upcoming offered classes (timeline) and what their schedule will be/shall be.,1,0,1,0,1,1,0,0,0
3,promise_reclass.csv,,The system will notify affected parties when changes occur affecting clinicals including but not limited to clinical section capacity changes and clinical section cancellations.,1,0,1,0,1,1,0,0,0
3,promise_reclass.csv,,The system will notify affected parties when changes occur affecting classes including but not limited to class cancellations class section detail changes and changes to class offerings for a given quarter.,1,0,1,0,1,1,0,0,0
3,promise_reclass.csv,,The system will notify affected parties when changes occur affecting cohorts including but not limited to changes to the sequence for a cohort’s program of study and changes to a given week’s schedule (lab cancelled this week due to instructor illness).,1,0,1,0,1,1,0,0,0
3,promise_reclass.csv,,The system will notify affected parties when changes occur affecting specific students including but not limited to changing a student’s status from full time to part time and moving a student to a different clinical section.,1,0,1,0,1,1,0,0,0
3,promise_reclass.csv,,Program Administrators/Nursing Staff Members shall have the ability to modify information relating to cohorts including cohort identifier program of study preferred sequence of classes and quarters that a cohort will be taking specific classes.,1,1,0,1,1,1,0,0,0
3,promise_reclass.csv,,Program Administrators/Nursing Staff Members shall have the ability to modify information relating to a Program of Study within the Nursing Department including the Program of study name and required classes for that Program of Study.,1,1,0,1,1,1,0,0,0
3,promise_reclass.csv,,Program Administrators/Nursing Staff Members shall have the ability to modify information relating to a Clinical Site including the clinical site name site contact person contact information and address.,1,1,0,1,1,1,0,0,0
3,promise_reclass.csv,,Program Administrators/Nursing Staff Members shall have the ability to modify information relating to a Clinical Lab Section including the clinical site name the department/section for the lab the class instructor day and time of lab and contact information.,1,1,0,1,1,1,0,0,0
3,promise_reclass.csv,,Program Administrators/Nursing Staff Members shall have the ability to modify information relating to a Nursing Student including student ID student name phone number e-mail status (full time or part time) and program of study.,1,1,0,1,1,1,0,0,0
4,promise_reclass.csv,,The Disputes application shall comply with the corporate standards for user interface creation for internally and externally used applications.,0,0,0,0,0,0,1,1,0
4,promise_reclass.csv,,All screens created as part of the Disputes application must comply with corporate standards for interface creation.,0,0,0,0,0,0,1,1,0
4,promise_reclass.csv,,The list of dispute cases that are displayed after a search is performed must be color coded for easy identification of dispute cases based upon the dispute case status.,0,0,0,0,0,0,1,1,0
4,promise_reclass.csv,,100% of the cardmember and merchant services representatives shall use the Disputes application regularly after a 2-day training course.,0,0,0,0,0,0,1,1,0
4,promise_reclass.csv,,100% of cardmember services representatives shall be able to successfully create a dispute case on the first encounter after completing the training course.,0,0,0,0,0,0,1,1,0
4,promise_reclass.csv,,100% of merchant services representatives shall be able to successfully perform a follow up action on a dispute case on the first encounter after completing the training course.,0,0,0,0,0,0,1,1,0
4,promise_reclass.csv,,The maximum wait time for a user navigating from one screen to another within the Disputes application shall be no more than 5 seconds.,0,0,0,0,0,0,1,1,0
4,promise_reclass.csv,,The Disputes application shall support 350 concurrent users without any degradation of performance in the application.,0,0,0,0,0,0,1,1,0
4,promise_reclass.csv,,The Disputes application shall be available 24x7x365 with the exception of the following scheduled maintenance windows. Monday – Saturday 3:00am to 4:00am EST Sunday 1:00amd to 5:00am EST,0,0,0,0,0,0,1,1,0
4,promise_reclass.csv,,The Disputes application shall interface with the Statement Database. The Statement Database provides the transaction details to the Disputes System. All transaction details must be obtained from the Statement Database,0,0,0,0,0,0,1,1,0
4,promise_reclass.csv,,The Disputes application shall interface with the Cardmember Information Database. The Cardmember Information Database provides detailed information with regard to a cardmember. All cardmember detail information must be obtained from the Cardmember Information Database.,0,0,0,0,0,0,1,1,0
4,promise_reclass.csv,,The Disputes applications shall interface with the Merchant Information Database. The Merchant Information Database provides detailed information with regard to the merchant. All merchant detail information shall be obtained from the Merchant Information Database.,0,0,0,0,0,0,1,1,0
4,promise_reclass.csv,,The Disputes application shall interface with the Letters application. This will allow the Disputes application to request letters as part of the dispute initiation and dispute follow up process. All letter requests must be sent to the Print Letter Utility application.,0,0,0,0,0,0,1,1,0
4,promise_reclass.csv,,The Disputes application shall interface with the Cardmember Posting and Billing System. This will allow the Disputes application to request adjustments to cardmember and merchant’s accounts. All adjustment requests must be sent to the Cardmember Posting and Billing System.,0,0,0,0,0,0,1,1,0
4,promise_reclass.csv,,The Disputes application shall ensure that only users with the appropriate access level are allowed to initiate dispute requests.,0,0,0,0,0,0,1,1,0
