file,ID,text
EA57.txt,EA57.txt.precondition,The user has successfully logged in and selected the Social Assistance feature
EA57.txt,EA57.txt.postcondition,The system has encountered an error in filling out the form so it calls the use case Data Errati OR The user returns to the previous screen OR The system encountered an unanticipated error so it calls the use case Service Not Available Unanticipated Quality Requirements
EA57.txt,EA57.txt.flow_of_events.0,The user selects the Social Assistance feature by selecting Disabled Parking Release ''
EA57.txt,EA57.txt.flow_of_events.1,The system displays the form for entering applicant and recipient data if different
EA57.txt,EA57.txt.flow_of_events.2,The user enters the master data of the applicant and those of the recipient if different if necessary specifying the relationship to that person
EA57.txt,EA57.txt.flow_of_events.3,Also specified is the type of documentation attached to the traffic police command medical-legal certificate issued by the ASL commission
EA57.txt,EA57.txt.flow_of_events.4,It then submits the form
EA57.txt,EA57.txt.flow_of_events.5,The system picks up the master data of the recipient citizen
EA57.txt,EA57.txt.flow_of_events.6,The request is sent to the traffic police command and the user is notified of the submission
EA68.txt,EA68.txt.name,News Canceled
EA68.txt,EA68.txt.actor,Started by Citizen
EA68.txt,EA68.txt.precondition,This use case extends Subscribe News Informagiovani and occurs when a citizen decides to cancel informagiovani news
EA68.txt,EA68.txt.postcondition,The system resubmits the form
EA68.txt,EA68.txt.quality_requirement,Not provided
EA68.txt,EA68.txt.flow_of_events.0,Citizen decides she wants to cancel informagiovani news and then enters in the form that she wants to cancel it
EA68.txt,EA68.txt.flow_of_events.1,The system receives the form notifies that the news has been cancelled and resubmits the form
EA41.txt,EA41.txt.name,Visualization Practice
EA41.txt,EA41.txt.actor,Started by citizen
EA41.txt,EA41.txt.precondition,The citizen has authenticated in the system
EA41.txt,EA41.txt.postcondition,The citizen displays the screen OR In the case where the citizen wants to delete a file the system calls the use case Delete Practice OR In the case where the citizen wants to edit a practice the system calls the use case Edit Practice OR In the case where the service is not available the use case is called of use case Service Not Available
EA41.txt,EA41.txt.quality_requirement,Not Available
EA41.txt,EA41.txt.flow_of_events.0,Citizen clicks on the button view practices ID Card Change of Residence
EA41.txt,EA41.txt.flow_of_events.1,The system displays a screen with the practices that concern the citizen
EA89.txt,EA89.txt.name,Request Number Civic
EA89.txt,EA89.txt.actor,Initiated by citizen communicates with employee
EA89.txt,EA89.txt.precondition,The citizen has authenticated in the system
EA89.txt,EA89.txt.postcondition,The system displays a message notifying the request The system sends a request notification message to the appropriate clerk OR in the case of incorrect data entry the system invokes the use case Data Errati OR in the case of technical failures the system invokes the use case Service Not Available
EA89.txt,EA89.txt.quality_requirement,Not Available
EA89.txt,EA89.txt.flow_of_events.0,Citizen accesses the house number request area using the appropriate link
EA89.txt,EA89.txt.flow_of_events.1,The system displays the form for entering the data required for the request The citizen enters the required data
EA89.txt,EA89.txt.flow_of_events.2,The system verifies the correctness and completeness of the data then displays a summary screen or activates the use case Dati Errati The citizen confirms the operation
EA89.txt,EA89.txt.flow_of_events.3,The system displays a message notifying the request
EA89.txt,EA89.txt.flow_of_events.4,The system sends a message notifying the appropriate employee of the request
EA133.txt,EA133.txt.name,Request TOSAP Rified
EA133.txt,EA133.txt.actor,Started by Employee
EA133.txt,EA133.txt.precondition,The Clerk has authenticated in the system Request TOSAP Rejected includes the Request TOSAP use case
EA133.txt,EA133.txt.postcondition,The system notifies the citizen of the outcome
EA133.txt,EA133.txt.quality_requirement,Not provided
EA133.txt,EA133.txt.flow_of_events.0,The Employee displays the notification received
EA133.txt,EA133.txt.flow_of_events.1,The System displays to the Clerk the request made by the citizen
EA133.txt,EA133.txt.flow_of_events.2,The Clerk reveals an error in the request and rejects the procedure the request
EA133.txt,EA133.txt.flow_of_events.3,The System sends a notification to the citizen who requested the service
EA129.txt,EA129.txt.name,Request IPPA Accepted
EA129.txt,EA129.txt.actor,Started by Employee
EA129.txt,EA129.txt.precondition,The Clerk has authenticated in the system Request IPPA Accepted includes the case use case Request IPPA
EA129.txt,EA129.txt.postcondition,The system notifies the citizen of the outcome
EA129.txt,EA129.txt.quality_requirement,Not provided
EA129.txt,EA129.txt.flow_of_events.0,The Employee displays the notification received
EA129.txt,EA129.txt.flow_of_events.1,The System displays to the Clerk the request made by the citizen
EA129.txt,EA129.txt.flow_of_events.2,The Clerk certifies the validity of the request by checking the accuracy of the data and enables the bureaucratic procedure for requesting the service
EA129.txt,EA129.txt.flow_of_events.3,The System sends a confirmation e-mail to the citizen who requested the service
EA13.txt,EA13.txt.name,Edit E Mail Citizen
EA13.txt,EA13.txt.actor,Started by Citizen
EA13.txt,EA13.txt.precondition,The citizen has authenticated in the system
EA13.txt,EA13.txt.postcondition,The system saves the new email The system detects an error and retrieves the use case Dati Errati OR In the case where the service is not available the use case Service Not Available is invoked
EA13.txt,EA13.txt.quality_requirement,Not Provided
EA13.txt,EA13.txt.flow_of_events.0,Citizen accesses the e-email edit form
EA13.txt,EA13.txt.flow_of_events.1,The system shows the form the enter the new email
EA13.txt,EA13.txt.flow_of_events.2,The citizen enters the new e-mail and presses the confirmation button
EA13.txt,EA13.txt.flow_of_events.3,The system updates the new e-mail
EA55.txt,EA55.txt.name,Plan Zone Assistance
EA55.txt,EA55.txt.actor,Started by User
EA55.txt,EA55.txt.precondition,The user accessed the system
EA55.txt,EA55.txt.postcondition,The user returns to the previous screen OR The system encountered an unanticipated error so calls the use case Service Not Available Unanticipated Quality Requirements
EA55.txt,EA55.txt.flow_of_events.0,Remote user selects the Social Assistance feature by selecting Area Plan assistance services ''
EA55.txt,EA55.txt.flow_of_events.1,The system displays the area plan regarding care services
EA38.txt,EA38.txt.name,Lost Identity Card
EA38.txt,EA38.txt.actor,Started by Citizen continued by employee
EA38.txt,EA38.txt.precondition,The Citizen must be authenticated in the system
EA38.txt,EA38.txt.postcondition,The System creates the document to be delivered to the appropriate office OR In the case where the service is not available the use case Service Not Available is invoked
EA38.txt,EA38.txt.quality_requirement,Not Provided
EA38.txt,EA38.txt.flow_of_events.0,The Citizen presses on the Lost ID Card button
EA38.txt,EA38.txt.flow_of_events.1,The system directly sends a lost card notification to the appropriate clerk
EA38.txt,EA38.txt.flow_of_events.2,The Citizen goes to the clerk 's office with a copy of the loss report
EA85.txt,EA85.txt.name,Search File Building
EA85.txt,EA85.txt.actor,Initiated by citizen
EA85.txt,EA85.txt.precondition,The citizen has authenticated in the system
EA85.txt,EA85.txt.postcondition,The system displays the file OR In the case where the citizen is not found the system invokes the use case Data Errati OR In the case of technical failures the system invokes the use case Service Not Available OR If the citizen wants a copy of the file found it calls the use case Request Copy File Edossier
EA85.txt,EA85.txt.quality_requirement,Not Provided
EA85.txt,EA85.txt.flow_of_events.0,Citizen accesses the search area
EA85.txt,EA85.txt.flow_of_events.1,The system displays the form for entering the search key Citizen enters the search key
EA85.txt,EA85.txt.flow_of_events.2,The system displays the results of the search The citizen selects the file
EA85.txt,EA85.txt.flow_of_events.3,The system displays the file
EA103.txt,EA103.txt.name,Download Module
EA103.txt,EA103.txt.actor,Started by Citizen
EA103.txt,EA103.txt.precondition,The Citizen is authenticated in the municipal system OR The Citizen has accessed the municipal system
EA103.txt,EA103.txt.postcondition,The Citizen has successfully downloaded the form with permission from the system and therefore the Come Become Volunteer use case will be invoked OR The Citizen fails to view the page about downloading the form and the use case Service Not Available which handles Technical Failure cases will be extended
EA103.txt,EA103.txt.quality_requirement,The system response time ranges from to seconds to load the form if the Citizen can view it correctly Response time increases on the order of seconds if the Citizen does not correctly display what he or she has requested
EA103.txt,EA103.txt.flow_of_events.0,The Citizen accesses the download of the form as they want to join the Volunteerism
EA103.txt,EA103.txt.flow_of_events.1,The system responds to this need with the ability to view the form The Citizen acknowledges the form and decides to start downloading the file
EA103.txt,EA103.txt.flow_of_events.2,The system responds to the Citizen 's need by saving the form to join the Volunteer action
EA48.txt,EA48.txt.name,Domestic Assistance Domestic Assistance
EA48.txt,EA48.txt.actor,Initiated by User Communicates with Social Services Office
EA48.txt,EA48.txt.precondition,The user has successfully logged in and selected the Social Assistance feature
EA48.txt,EA48.txt.postcondition,The system has encountered an error in filling out the form so it calls the use case Data Errati OR The user returns to the previous screen OR The system encountered an unanticipated error so it calls the use case Service Not Available
EA48.txt,EA48.txt.quality_requirement,Unanticipated
EA48.txt,EA48.txt.flow_of_events.0,User selects Home care request elderly minors handicapped ''
EA48.txt,EA48.txt.flow_of_events.1,The system displays the form for entering applicant and recipient data
EA48.txt,EA48.txt.flow_of_events.2,The user enters the master data of the applicant and if necessary enters the data of a third person specifying the relationship with that person
EA48.txt,EA48.txt.flow_of_events.3,The system picks up the data of the applicant citizen the master data of the recipient citizen in case the applicant and recipient were not the same person and the data concerning the household of the recipient Citizen
EA48.txt,EA48.txt.flow_of_events.4,The user specifies the psycho-physical conditions of the recipient specifying the attached documents disability certificate issued by the ASL commission andor health card of the attending physician andor certificate of the pension provider ISEE model finally specifying a possible date of appointment with social workers
EA48.txt,EA48.txt.flow_of_events.5,Then submit the form
EA48.txt,EA48.txt.flow_of_events.6,The system picks up data regarding any social welfare services the recipient already uses
EA48.txt,EA48.txt.flow_of_events.7,It then forwards the request to the Social Services office and notifies the Citizen that the request has been made
EA61.txt,EA61.txt.name,Card Annulled
EA61.txt,EA61.txt.actor,Started by Citizen
EA61.txt,EA61.txt.precondition,This use case extends Enrollment Card Youth and checks when a citizen decides to cancel the youth card
EA61.txt,EA61.txt.postcondition,The system resubmits the form
EA61.txt,EA61.txt.quality_requirement,Not provided
EA61.txt,EA61.txt.flow_of_events.0,Citizen decides he wants to cancel the youth card and then enters in the form that he wants to cancel it
EA61.txt,EA61.txt.flow_of_events.1,The system receives the form notifies that the card has been cancelled and resubmits the form
EA29.txt,EA29.txt.name,Edit Practice
EA29.txt,EA29.txt.actor,Started by citizen
EA29.txt,EA29.txt.precondition,The citizen has authenticated into the system This use case extends View Practice and occurs when the citizen wants to edit the file
EA29.txt,EA29.txt.postcondition,The system edits the practice OR In the case where the service is not available the use case is invoked of use Service Not Available
EA29.txt,EA29.txt.quality_requirement,Not Provided
EA29.txt,EA29.txt.flow_of_events.0,Citizen presses the Edit Practice button ID Card Change of Residence if the practice has not been initialized
EA29.txt,EA29.txt.flow_of_events.1,The system displays a form for editing the practice
EA29.txt,EA29.txt.flow_of_events.2,The citizen enters the data
EA29.txt,EA29.txt.flow_of_events.3,The system saves the changes made
EA23.txt,EA23.txt.name,Registration Citizen
EA23.txt,EA23.txt.actor,Started by Citizen
EA23.txt,EA23.txt.precondition,The citizen has accessed the system
EA23.txt,EA23.txt.postcondition,The system registers the citizen OR In case the citizen enters incorrect data the system calls the case use case Data Errati OR In the case where the service is not available the use case Service Not Available is called
EA23.txt,EA23.txt.quality_requirement,The name string corresponding to the name of the ID card holder is well formed contains characters az AZ ' and is less than characters long and is not empty The string of the last name corresponding to the first name of the ID card holder is well-formed contains characters az AZ ' and has length less than characters and is not empty The string of the Tax Code corresponding to the actual tax code of the holder is in accordance with regulations and has length of characters The Identity Card string is present in the system consists of X Xnnnnnnn X letter n number and has length of characters The email string consists of x xx and has a length of less than characters and is not empty The username string is not already in the system is well formed contains characters az AZ - and has length less than characters and is not empty The password string is well formed contains characters az AZ - and has a length between and characters
EA23.txt,EA23.txt.flow_of_events.0,Citizen accesses the registration form
EA23.txt,EA23.txt.flow_of_events.1,The system displays the form for registration
EA23.txt,EA23.txt.flow_of_events.2,The citizen enters hisher data and presses the confirmation button
EA23.txt,EA23.txt.flow_of_events.3,The system verifies the correctness of the data saves them and sends an e-mail of successful registration to the citizen
EA137.txt,EA137.txt.name,Consultation Help On- Line
EA137.txt,EA137.txt.actor,Started by Citizen
EA137.txt,EA137.txt.precondition,The citizen has logged into the system
EA137.txt,EA137.txt.postcondition,The citizen has accessed information related to a particular functionality
EA137.txt,EA137.txt.quality_requirement,Not provided
EA137.txt,EA137.txt.flow_of_events.0,The Citizen enters the online help section
EA137.txt,EA137.txt.flow_of_events.1,The system presents a screen containing the list of features
EA137.txt,EA137.txt.flow_of_events.2,The Citizen accesses the help information by clicking on the link related to the functionality they wish to receive
EA137.txt,EA137.txt.flow_of_events.3,The system presents the help information explaining the methods and actions to be performed for the specific functionality
EA74.txt,EA74.txt.name,Information Events In The Territory
EA74.txt,EA74.txt.actor,Started by Citizen
EA74.txt,EA74.txt.precondition,The citizen has logged into the system
EA74.txt,EA74.txt.postcondition,The citizen has viewed the event information OR In case the citizen wants to book the event will be referred to the event site
EA74.txt,EA74.txt.quality_requirement,Not provided
EA74.txt,EA74.txt.flow_of_events.0,The Citizen requests to view the list of events
EA74.txt,EA74.txt.flow_of_events.1,The system allows to view the list of events
EA74.txt,EA74.txt.flow_of_events.2,The Citizen chooses the event
EA74.txt,EA74.txt.flow_of_events.3,The system returns information regarding the chosen event by displaying data such as - - - the location date and time of the event site managing the event Pro-loco
EA45.txt,EA45.txt.name,Welcome Night
EA45.txt,EA45.txt.actor,Initiated by User Communicates with Social Services Office
EA45.txt,EA45.txt.precondition,The user has successfully logged in and selected the Social Assistance feature
EA45.txt,EA45.txt.postcondition,The system has encountered an error in filling out the form so it calls the use case Data Errati OR The user returns to the previous screen OR The system encountered an unanticipated error so it calls the use case Service Not Available
EA45.txt,EA45.txt.quality_requirement,Unanticipated
EA45.txt,EA45.txt.flow_of_events.0,User selects Social Work feature by selecting Night Reception Request ''
EA45.txt,EA45.txt.flow_of_events.1,The system displays the form for entering applicant and recipient data
EA45.txt,EA45.txt.flow_of_events.2,The user enters hisher own data and if necessary enters the data of a third person specifying the relationship with that person
EA45.txt,EA45.txt.flow_of_events.3,He also specifies an alternative home or address and a possible date of appointment with social workers
EA45.txt,EA45.txt.flow_of_events.4,He then submits the form
EA45.txt,EA45.txt.flow_of_events.5,The system picks up the master data of the requesting citizen and the receiving citizen if different from the requestor and data regarding the receiving Citizen 's household
EA45.txt,EA45.txt.flow_of_events.6,The request is sent to the Social Services office and the user is notified of the submission
EA59.txt,EA59.txt.name,Unsubscribe News Informagiovani
EA59.txt,EA59.txt.actor,Started by Citizen
EA59.txt,EA59.txt.precondition,This case requires that the citizen has gone through the authentication procedure
EA59.txt,EA59.txt.postcondition,The system has executed the citizen 's request OR If an error occurs in the process of deleting from the news service the system calls the use case Service Not Available
EA59.txt,EA59.txt.quality_requirement,Not Available
EA59.txt,EA59.txt.flow_of_events.0,Citizen requests unsubscription from advertisement service related to informagiovani news
EA59.txt,EA59.txt.flow_of_events.1,The system displays a form to confirm the request
EA59.txt,EA59.txt.flow_of_events.2,The citizen confirms the unsubscribe operation
EA59.txt,EA59.txt.flow_of_events.3,The system deletes the citizen from the advertisement service
EA106.txt,EA106.txt.name,Hydro-pluviometric monitoring
EA106.txt,EA106.txt.actor,Started by Citizen
EA106.txt,EA106.txt.precondition,The Citizen is authenticated in the municipal system OR The Citizen has accessed the municipal system
EA106.txt,EA106.txt.postcondition,The Citizen is satisfied with the information received from the form heshe was offered OR The Citizen is unable to view the page heshe requested and the use case Service Not Available that handles technical failure cases is extended
EA106.txt,EA106.txt.quality_requirement,System response time is in the hundredths of a second range if it correctly displays the card The response time increases and falls within the terms of seconds from a minimum of to a maximum of
EA106.txt,EA106.txt.flow_of_events.0,The Citizen accesses this screen as he wants to satisfy his curiosity in knowing the situation monitored by the Civil Defense of municipal waters
EA106.txt,EA106.txt.flow_of_events.1,The system responds with a screen where heshe can view information about how the municipal water is being monitored the bacteriological situation and an update of the latest analysis performed on the samples taken
EA62.txt,EA62.txt.name,Elimination Reservation Interview
EA62.txt,EA62.txt.actor,Started by Citizen
EA62.txt,EA62.txt.precondition,This extends the View Preservation Consultor io use case by considering the case where the citizen wants to delete the chosen reservation
EA62.txt,EA62.txt.postcondition,The system has made the cancellation of the reservation
EA62.txt,EA62.txt.quality_requirement,Not provided
EA62.txt,EA62.txt.flow_of_events.0,Citizen requests cancellation of interview reservation in the counseling center
EA62.txt,EA62.txt.flow_of_events.1,The system displays a form to confirm the request
EA62.txt,EA62.txt.flow_of_events.2,The citizen confirms the deletion of the reservation
EA62.txt,EA62.txt.flow_of_events.3,Thesystemeliminatesbooking
EA101.txt,EA101.txt.name,Committee
EA101.txt,EA101.txt.actor,Started by Citizen
EA101.txt,EA101.txt.precondition,The Citizen is authenticated within the municipal system OR The Citizen has accessed the municipal system
EA101.txt,EA101.txt.postcondition,The Citizen becomes aware of the components of the municipal body OR If unable to view the page the use case is extended Service Not Available which handles technical failure cases
EA101.txt,EA101.txt.quality_requirement,The response time to the Citizen 's curiosity is in the hundredths of a second range if the screen describing the use case Committee is displayed correctly If the screen can not be provided the system will respond in times ranging in the range of - seconds
EA101.txt,EA101.txt.flow_of_events.0,The Citizen accesses this service in order to take note of the hierarchical composition of the Civil Defense
EA101.txt,EA101.txt.flow_of_events.1,The system responds to the curiosity of the Citizen with a screen where there is an organizational chart of the components of the Municipal Civil Defense in accordance with the other governmental institutions in the area according to the law of the Municipal Council approved by all
EA122.txt,EA122.txt.name,IPPA
EA122.txt,EA122.txt.actor,Initiated by Citizen
EA122.txt,EA122.txt.precondition,The Citizen has logged in The Citizen has made the request for the specific service The request for the service has been accepted
EA122.txt,EA122.txt.postcondition,Payment has been made OR In the case where there is insufficient funds to cover the payment or an error occurs in the transaction the System calls the case use case Payment Not Received OR In the case where there are general errors the System calls the use case Service Not Available
EA122.txt,EA122.txt.quality_requirement,Not Provided
EA122.txt,EA122.txt.flow_of_events.0,The Citizen clicks on the button to access the Online Tax Payment area
EA122.txt,EA122.txt.flow_of_events.1,The System displays the list of taxes that can be paid online
EA122.txt,EA122.txt.flow_of_events.2,The Citizen selects the section on Advertising and Public Display Tax and its payment and enters the file code
EA122.txt,EA122.txt.flow_of_events.3,The System redirects the Citizen to the necessary section showing the form of the relevant tax and the relevant amount to be paid
EA122.txt,EA122.txt.flow_of_events.4,The Citizen confirms that the information is correct selects the preferred payment method and initiates the transaction
EA122.txt,EA122.txt.flow_of_events.5,The System performs the transaction and displays a successful payment message
EA22.txt,EA22.txt.name,Registration Citizen
EA22.txt,EA22.txt.actor,Started by Citizen
EA22.txt,EA22.txt.precondition,The citizen has accessed the system
EA22.txt,EA22.txt.postcondition,The system registers the citizen OR In case the citizen enters incorrect data the system calls the case use case Data Errati OR In the case where the service is not available the use case Service Not Available is called
EA22.txt,EA22.txt.quality_requirement,The name string corresponding to the name of the ID card holder is well formed contains characters az AZ ' and is less than characters long and is not empty The string of the last name corresponding to the first name of the ID card holder is well-formed contains characters az AZ ' and has length less than characters and is not empty The string of the Tax Code corresponding to the actual tax code of the holder is in accordance with regulations and has length of characters The Identity Card string is present in the system consists of X Xnnnnnnn X letter n number and has length of characters The email string consists of x xx and has a length of less than characters and is not empty The username string is not already in the system is well formed contains characters az AZ - and has length less than characters and is not empty The password string is well formed contains characters az AZ - and has a length between and characters
EA22.txt,EA22.txt.flow_of_events.0,Citizen accesses the registration form
EA22.txt,EA22.txt.flow_of_events.1,The system displays the form for registration
EA22.txt,EA22.txt.flow_of_events.2,The citizen enters hisher data and presses the confirmation button
EA22.txt,EA22.txt.flow_of_events.3,The system verifies the correctness of the data saves them and sends an e-mail of successful registration to the citizen
EA126.txt,EA126.txt.name,Payment Unsuccessful
EA126.txt,EA126.txt.actor,Started by Citizen
EA126.txt,EA126.txt.precondition,This use case extends ICI IRPEF TIA TOSAP IPPA and Payment Multa and is invoked when errors occur due to the payment method
EA126.txt,EA126.txt.postcondition,s The System notifies the error and displays the form again for completion
EA126.txt,EA126.txt.quality_requirement,Not provided
EA126.txt,EA126.txt.flow_of_events.0,The Citizen clicks on the button to access the Online Payment area for taxes or fines
EA126.txt,EA126.txt.flow_of_events.1,The System displays the list of feesfines that can be paid online
EA126.txt,EA126.txt.flow_of_events.2,The Citizen selects the taxfine of interest
