file,ID,text
EA21.txt,EA21.txt.postcondition,The system sends the password OR In the case where the employee enters a serial number that is not in the system the system calls the use case Data Errati OR In the case where the service is not available the use case Service Not Available is called
EA21.txt,EA21.txt.quality_requirement,Not expected
EA21.txt,EA21.txt.flow_of_events.0,The employee has forgotten the password and presses the password recovery button
EA21.txt,EA21.txt.flow_of_events.1,The system displays the form for entering the matriculation number
EA21.txt,EA21.txt.flow_of_events.2,The employee enters hisher matriculation number and presses the confirmation button
EA21.txt,EA21.txt.flow_of_events.3,The system verifies the data and sends the password to the employee 's email address
EA30.txt,EA30.txt.name,Identity Card Request
EA30.txt,EA30.txt.actor,Started by Citizen continued employee
EA30.txt,EA30.txt.precondition,The Citizen has authenticated in the system The citizen exercises parental authority over the person concerned
EA30.txt,EA30.txt.postcondition,The clerk receives the file and chooses whether to accept it or not by calling the use case Request Card Of Identity Rejected or Request Card Of Identity Accepted OR respectively In the case where the service is not available the use case Service Not Available is invoked
EA30.txt,EA30.txt.flow_of_events.0,Citizen views family status and selects a family member
EA30.txt,EA30.txt.flow_of_events.1,The system displays a form for entering personal data Height special marks etc
EA30.txt,EA30.txt.flow_of_events.2,The Citizen enters the data selects the payment method and presses the confirm button
EA30.txt,EA30.txt.flow_of_events.3,The system shows the screen with the documentation to be shown at the counter on the days and hours the office is open
EA30.txt,EA30.txt.flow_of_events.4,The citizen confirms the transaction
EA30.txt,EA30.txt.flow_of_events.5,The system notifies the clerk of the request
EA86.txt,EA86.txt.name,Request Authorization
EA86.txt,EA86.txt.actor,Initiated by citizen communicates with employee
EA86.txt,EA86.txt.precondition,The citizen has authenticated in the system
EA86.txt,EA86.txt.postcondition,The system displays the form for printing The system sends a message notifying the relevant clerk of the request OR in the case of incorrect data entered the system invokes the use case Dati Errati OR in the case of technical failures the system invokes the use case Service Not Available
EA86.txt,EA86.txt.quality_requirement,Not Available
EA86.txt,EA86.txt.flow_of_events.0,Citizen accesses the certificate and authorization issuance area using the appropriate link
EA86.txt,EA86.txt.flow_of_events.1,The system displays the form for entering the data required for the authorization request eg
EA86.txt,EA86.txt.flow_of_events.2,authorization connection to the water supply network authorization connection to the sewerage network
EA86.txt,EA86.txt.flow_of_events.3,The citizen enters the required data
EA86.txt,EA86.txt.flow_of_events.4,The system verifies the correctness and completeness of the data then displays a summary screen or activates the use case Dati Errati
EA86.txt,EA86.txt.flow_of_events.5,The citizen confirms the operation
EA86.txt,EA86.txt.flow_of_events.6,The system displays the form for printing
EA86.txt,EA86.txt.flow_of_events.7,The system sends a message notifying the appropriate employee of the request
EA86.txt,EA86.txt.flow_of_events.8,The citizen makes the printout to be delivered to the municipal office with the stamp and attachments
EA71.txt,EA71.txt.name,View Reservation Consultation
EA71.txt,EA71.txt.actor,Started by Citizen
EA71.txt,EA71.txt.precondition,This case requires that the Citizen has carried out the authentication procedure
EA71.txt,EA71.txt.postcondition,The Citizen has viewed the information about the reservation OR In case the citizen wants to modifydelete a reservation the system calls the use case Modify Preservation Intercourse Elimi nation Preservation Intercourse
EA71.txt,EA71.txt.quality_requirement,Not provided
EA71.txt,EA71.txt.flow_of_events.0,Citizen requests to view the reservation made at a consultation center
EA71.txt,EA71.txt.flow_of_events.1,The system returns information regarding the selected reservation by displaying data such as - Date and time - Consultatory
EA81.txt,EA81.txt.name,Definition Building Offenses
EA81.txt,EA81.txt.actor,Initiated by citizen communicates with employee
EA81.txt,EA81.txt.precondition,The citizen has authenticated in the system
EA81.txt,EA81.txt.postcondition,The system displays a message notifying the request The system sends a request notification message to the relevant clerk OR in the case of incorrect data entry the system invokes the use case Data Errati OR in the case of technical failures the system invokes the use case Service Not Available
EA81.txt,EA81.txt.quality_requirement,Not Available
EA81.txt,EA81.txt.flow_of_events.0,Citizen accesses the definition of construction offenses request area via the appropriate link
EA81.txt,EA81.txt.flow_of_events.1,The system displays the form for entering the data necessary for the request
EA81.txt,EA81.txt.flow_of_events.2,The citizen enters the required data
EA81.txt,EA81.txt.flow_of_events.3,The system verifies the correctness and completeness of the data then displays a summary screen or activates the Dati Errati use case
EA81.txt,EA81.txt.flow_of_events.4,The citizen confirms the operation
EA81.txt,EA81.txt.flow_of_events.5,The system displays a message notifying of the request
EA81.txt,EA81.txt.flow_of_events.6,The system sends a message notifying the appropriate employee of the request
EA82.txt,EA82.txt.name,Declaration Substitute Act Notoriety
EA82.txt,EA82.txt.actor,Initiated by citizen communicates with employee
EA82.txt,EA82.txt.precondition,The citizen has authenticated in the system
EA82.txt,EA82.txt.postcondition,The system displays a message notifying the request The system sends a request notification message to the relevant clerk OR in the case of incorrect data entry the system invokes the use case Data Errati OR in the case of technical failures the system invokes the use case Service Not Available
EA82.txt,EA82.txt.quality_requirement,Not Available
EA82.txt,EA82.txt.flow_of_events.0,Citizen accesses the Declaration in Lieu of Affidavit area using the appropriate link
EA82.txt,EA82.txt.flow_of_events.1,The system displays the form for entering the data necessary for the request
EA82.txt,EA82.txt.flow_of_events.2,The citizen enters the required data
EA82.txt,EA82.txt.flow_of_events.3,The system verifies the correctness and completeness of the data then displays a summary screen or activates the Dati Errati use case
EA82.txt,EA82.txt.flow_of_events.4,The citizen confirms the operation
EA82.txt,EA82.txt.flow_of_events.5,The system displays a notification message
EA82.txt,EA82.txt.flow_of_events.6,The system sends a message notifying the appropriate employee of the request
EA90.txt,EA90.txt.name,Request Catastical Service
EA90.txt,EA90.txt.actor,Initiated by citizen communicates with clerk
EA90.txt,EA90.txt.precondition,The citizen has authenticated in the system
EA90.txt,EA90.txt.postcondition,The system displays a message notifying the citizen of the request The system displays a message of successful notification of the request to the employee OR in the case of incorrect data entry the system invokes the use case Data Errati OR in the case of technical failures the system invokes the use case Service Not Available
EA90.txt,EA90.txt.quality_requirement,Not Available
EA90.txt,EA90.txt.flow_of_events.0,Citizen accesses the municipal cadastral service area via the appropriate link
EA90.txt,EA90.txt.flow_of_events.1,The system displays the form for entering the necessary data for the request
EA90.txt,EA90.txt.flow_of_events.2,The citizen enters the required data
EA90.txt,EA90.txt.flow_of_events.3,The system verifies the correctness and completeness of the data then displays a summary screen or activates the Dati Errati use case
EA90.txt,EA90.txt.flow_of_events.4,The citizen confirms the operation
EA90.txt,EA90.txt.flow_of_events.5,The system displays the payment method
EA90.txt,EA90.txt.flow_of_events.6,The citizen makes the choice
EA90.txt,EA90.txt.flow_of_events.7,The system sends the appropriate employee a message notifying him of the request
EA90.txt,EA90.txt.flow_of_events.8,The system notifies the citizen that the request has been submitted and the copy will be will be sent shortly
EA139.txt,EA139.txt.name,Service Not Available
EA139.txt,EA139.txt.actor,Started by Citizen
EA139.txt,EA139.txt.precondition,This use case extends use cases and handles exceptional cases of failure due to technical problems
EA139.txt,EA139.txt.postcondition,The input form is resubmitted
EA139.txt,EA139.txt.quality_requirement,Not expected
EA139.txt,EA139.txt.flow_of_events.0,System displays a message on the terminal screen indicating that the request can not be made
EA139.txt,EA139.txt.flow_of_events.1,Citizen reads the notification message
EA139.txt,EA139.txt.flow_of_events.2,System resubmits input form
EA9.txt,EA9.txt.name,Logout Citizen
EA9.txt,EA9.txt.actor,Initiated by citizen
EA9.txt,EA9.txt.precondition,The citizen has logged into the system Logout condition The system closes the citizen 's session
EA9.txt,EA9.txt.quality_requirement,Not provided
EA9.txt,EA9.txt.flow_of_events.0,Citizen wants to end the work session and clicks on the Logout button
EA9.txt,EA9.txt.flow_of_events.1,The system logs the citizen out of the system and returns to the main screen
EA119.txt,EA119.txt.name,Calculate Amount Not Result
EA119.txt,EA119.txt.actor,Started by Citizen
EA119.txt,EA119.txt.precondition,This use case extends Calculate Import and is invoked when the Citizen enters incorrect data OR an error has occurred in the calculation of the amount
EA119.txt,EA119.txt.postcondition,The System notifies the error and resubmits the form to the Citizen
EA119.txt,EA119.txt.quality_requirement,Not Provided
EA119.txt,EA119.txt.flow_of_events.0,The Citizen presses the button related to the tax calculation function
EA119.txt,EA119.txt.flow_of_events.1,The System presents the list of taxes and fees for which the amount can be calculated
EA119.txt,EA119.txt.flow_of_events.2,The Citizen selects the tax of interest
EA119.txt,EA119.txt.flow_of_events.3,The System shows a form to be filled in for calculation
EA119.txt,EA119.txt.flow_of_events.4,The Citizen enters the necessary data
EA119.txt,EA119.txt.flow_of_events.5,The System verifies the correctness of the data but fails to perform the calculation notifying the user of the reason for failure
EA99.txt,EA99.txt.name,What Tempo Fa
EA99.txt,EA99.txt.actor,Started by Citizen
EA99.txt,EA99.txt.precondition,The Citizen is authenticated in the municipal system OR The Citizen has accessed the municipal system
EA99.txt,EA99.txt.postcondition,The Citizen is satisfied with the information received OR The Citizen is unable to view the municipal weather page therefore the use case Service Not Available which handles exceptional cases of technical failure is extended
EA99.txt,EA99.txt.quality_requirement,The system responds in a time varying on the order of hundredths of a second if the user correctly displays the screen related to weather conditions OR On the other hand the time varies in the order of seconds from a minimum of to a maximum of when the user Citizen fails to know the municipal weather conditions
EA99.txt,EA99.txt.flow_of_events.0,The Citizen accesses this screen to view the weather situation for the municipality in which he or she resides
EA99.txt,EA99.txt.flow_of_events.1,The system responds to the Citizen 's need by allowing him to view in addition to the weather situation of his municipality also that of the provinces of the region to which he belongs with update date minimum and maximum temperatures and of course weather conditions expressed with a small descriptive image
EA47.txt,EA47.txt.name,Assistance Housing
EA47.txt,EA47.txt.actor,Initiated by User Communicates with Social Services Office
EA47.txt,EA47.txt.precondition,The user has successfully logged in and selected the Social Assistance feature
EA47.txt,EA47.txt.postcondition,The system has encountered an error in filling out the form so it calls the use case Data Errati OR The user returns to the previous screen OR The system encountered an unanticipated error so it calls the use case Service Not Available
EA47.txt,EA47.txt.quality_requirement,Unanticipated
EA47.txt,EA47.txt.flow_of_events.0,User selects the Social Assistance feature by selecting Housing Assistance Request evictions ''
EA47.txt,EA47.txt.flow_of_events.1,The system displays the form for entering applicant and recipient data if different
EA47.txt,EA47.txt.flow_of_events.2,The user enters hisher own data and those of the recipient if the recipient is a third person if necessary specifying the relationship with that person also specifies the new domicile
EA47.txt,EA47.txt.flow_of_events.3,The user selects the attached documentation minutes of enforceable eviction the new registered lease and the ISEE model
EA47.txt,EA47.txt.flow_of_events.4,Heshe then submits the form
EA47.txt,EA47.txt.flow_of_events.5,The system retrieves the master data of the recipient citizen and data regarding the recipient Citizen 's household
EA47.txt,EA47.txt.flow_of_events.6,The request is sent to the Social Services office and the user is notified of the submission
EA96.txt,EA96.txt.name,Activities Useful
EA96.txt,EA96.txt.actor,Started by Citizen
EA96.txt,EA96.txt.precondition,The Citizen has authenticated into the municipal system OR The Citizen has accessed the system
EA96.txt,EA96.txt.postcondition,The Citizen has correctly viewed the introductory screen and decides to access one of the proposed screens by calling up the Woods use case or the Waste use case The Citizen fails to view the introductory page to the two use cases Woods Waste and therefore extends the Service Not Available use case that handles technical failure cases
EA96.txt,EA96.txt.quality_requirement,System response times are found to be on the order of hundredths of a second if the Citizen correctly views the page of choosing which use case to project to OR Response times are slowed due to external problems and range in the order of seconds to
EA96.txt,EA96.txt.flow_of_events.0,By selecting this use case the Citizen accesses a screen for choosing two use cases Woods Waste
EA96.txt,EA96.txt.flow_of_events.1,The system provides a simple and intuitive screen that allows the user to choose which of the two services to visit to indirectly help maintain acceptable municipal environmental conditions
EA96.txt,EA96.txt.flow_of_events.2,The Citizen chooses one of the two use cases Woods or Waste
EA96.txt,EA96.txt.flow_of_events.3,The system responds to the Citizen 's need by displaying the desired page he or she had requested
EA77.txt,EA77.txt.name,Entry Information
EA77.txt,EA77.txt.actor,Started by Employee
EA77.txt,EA77.txt.precondition,This case requires that the employee has gone through the authentication procedure
EA77.txt,EA77.txt.postcondition,The system has performed the insertion of the news OR If an error occurred in the insertion request the system calls the use case Service Not Available
EA77.txt,EA77.txt.quality_requirement,Not Available
EA77.txt,EA77.txt.flow_of_events.0,Employee requests the insertion of a new news item
EA77.txt,EA77.txt.flow_of_events.1,The system displays a form for submitting the request
EA77.txt,EA77.txt.flow_of_events.2,The clerk enters data about the new news in a form
EA77.txt,EA77.txt.flow_of_events.3,The system receives the form and enters the news into the system
EA11.txt,EA11.txt.name,Edit Citizen
EA11.txt,EA11.txt.actor,Started by employee
EA11.txt,EA11.txt.precondition,The employee has authenticated into the system This use case includes Search Citizen and occurs when the clerk wants to edit a citizen
EA11.txt,EA11.txt.postcondition,The system modifies the citizen OR In the case where the service is not available the use case is invoked of use Service Not Available
EA11.txt,EA11.txt.quality_requirement,Not Provided
EA11.txt,EA11.txt.flow_of_events.0,The clerk presses the edit citizen button
EA11.txt,EA11.txt.flow_of_events.1,The system displays a form for editing the citizen
EA11.txt,EA11.txt.flow_of_events.2,The employee enters the data
EA11.txt,EA11.txt.flow_of_events.3,The system saves the changes made
EA83.txt,EA83.txt.name,Vision Plan Regulator
EA83.txt,EA83.txt.actor,Initiated by citizen
EA83.txt,EA83.txt.precondition,The citizen has accessed the system
EA83.txt,EA83.txt.postcondition,The system displays the master plan OR in the case of technical failures the system retrieves the use case Service Not Available
EA83.txt,EA83.txt.quality_requirement,Not available
EA83.txt,EA83.txt.flow_of_events.0,Citizen accesses the Regulatory Plan area via the appropriate link
EA83.txt,EA83.txt.flow_of_events.1,the system displays the document
EA120.txt,EA120.txt.name,Contesta Multa
EA120.txt,EA120.txt.actor,Started by Citizen
EA120.txt,EA120.txt.precondition,The Citizen has authenticated in the system
EA120.txt,EA120.txt.postcondition,This use case extends Payment Multe and is invoked when the Citizen clicks on the button related to disputing fines OR In case there are generic errors the system calls the use case Service Not Available
EA120.txt,EA120.txt.quality_requirement,Not Provided
EA120.txt,EA120.txt.flow_of_events.0,The Citizen clicks on the button to access the online fine management feature
EA120.txt,EA120.txt.flow_of_events.1,The System redirects the Citizen to the desired section
EA120.txt,EA120.txt.flow_of_events.2,The Citizen clicks on the button to pay fines online
EA120.txt,EA120.txt.flow_of_events.3,The System searches for fines against the Citizen in the database for which payment has not yet been received
EA120.txt,EA120.txt.flow_of_events.4,The Citizen selects the fine for which heshe wishes to make a dispute
EA120.txt,EA120.txt.flow_of_events.5,The System displays all available information related to the fine as well as the form to be filled in for the dispute
EA120.txt,EA120.txt.flow_of_events.6,The Citizen enters the necessary information
EA120.txt,EA120.txt.flow_of_events.7,The System verifies that the information is correct forwards the dispute request to the appropriate person and notifies the Citizen
EA84.txt,EA84.txt.name,Submit Building Project
EA84.txt,EA84.txt.actor,Initiated by citizen communicates with employee
EA84.txt,EA84.txt.precondition,The citizen has authenticated in the system
EA84.txt,EA84.txt.postcondition,The system displays a message that the request has been notified The system sends a message notifying the relevant clerk of the request OR in the case of incorrect data entered the system invokes the use case Data Errati OR in the case of technical failures the system invokes the use case Service Not Available
EA84.txt,EA84.txt.quality_requirement,Not Available
EA84.txt,EA84.txt.flow_of_events.0,Citizen accesses the submit construction project area via the appropriate link
EA84.txt,EA84.txt.flow_of_events.1,The system displays the form for entering the required data
EA84.txt,EA84.txt.flow_of_events.2,The citizen enters the required data
EA84.txt,EA84.txt.flow_of_events.3,The system verifies the correctness and completeness of the data then displays a summary screen or activates the Dati Errati use case
EA84.txt,EA84.txt.flow_of_events.4,The citizen confirms the operation
EA84.txt,EA84.txt.flow_of_events.5,The system displays the form for printing
EA84.txt,EA84.txt.flow_of_events.6,The system sends a message notifying the appropriate employee of the request
EA84.txt,EA84.txt.flow_of_events.7,Citizen makes the printout to be delivered to the municipal office with the required documents and a revenue stamp attached
EA128.txt,EA128.txt.name,Request IPPA
EA128.txt,EA128.txt.actor,Initiated by Citizen communicates with Employee
EA128.txt,EA128.txt.precondition,The Citizen has authenticated in the system
EA128.txt,EA128.txt.postcondition,The clerk receives the file and chooses whether to accept it or not invoking the use case respectively Request IPPA Accepted Request IPPA Rified OR In case there are errors in the data o entered by the user the system calls the use case Data Errred
EA128.txt,EA128.txt.quality_requirement,Not expected
EA128.txt,EA128.txt.flow_of_events.0,The Citizen clicks on the button to access the municipality 's service request area
EA128.txt,EA128.txt.flow_of_events.1,The System redirects the Citizen to the required section
EA128.txt,EA128.txt.flow_of_events.2,The Citizen selects the section dedicated to the Advertising and Public Display Tax request
EA128.txt,EA128.txt.flow_of_events.3,The System displays the relevant request form automatically obtaining the necessary data
EA128.txt,EA128.txt.flow_of_events.4,The Citizen enters additional data necessary for correct completion of the form confirms the correctness of the information and sends the request
EA128.txt,EA128.txt.flow_of_events.5,The System notifies the employee of the request
EA56.txt,EA56.txt.name,Qualification Reduce Guerra
EA56.txt,EA56.txt.actor,Started by User
EA56.txt,EA56.txt.precondition,The user has accessed the system and selected the Social Assistance feature
EA56.txt,EA56.txt.postcondition,The user has viewed the page OR The user has selected one of the direct links to the various certificates birth certificate residence certificate death certificate thereby invoking the use case Request Certificates OR The system encountered an unanticipated error expected so it calls the use case Service Not Available Unanticipated Quality Requirements
EA56.txt,EA56.txt.flow_of_events.0,User selects the Request for recognition of qualification as a veteran or orphan of labor '' feature
EA56.txt,EA56.txt.flow_of_events.1,The system shows the information and related forms to be downloaded and sent to the Prefecture offering the option to print it out
EA56.txt,EA56.txt.flow_of_events.2,It also shows a direct link to the page for requesting the Birth Certificate Residence Certificate and Death Certificate
EA124.txt,EA124.txt.name,Forms
EA124.txt,EA124.txt.actor,Initiated by Citizen
EA124.txt,EA124.txt.precondition,The Citizen is logged in
EA124.txt,EA124.txt.postcondition,The download has been initialized OR In case there are general errors the system calls the use case Service Not Available
EA124.txt,EA124.txt.quality_requirement,Not expected
EA124.txt,EA124.txt.flow_of_events.0,Citizen clicks button to access forms section
EA124.txt,EA124.txt.flow_of_events.1,The System redirects the Citizen to the required section and displays the various forms available for download
EA124.txt,EA124.txt.flow_of_events.2,The Citizen selects the desired form
EA124.txt,EA124.txt.flow_of_events.3,The System starts the download
EA16.txt,EA16.txt.name,Edit Password Administrator
EA16.txt,EA16.txt.actor,Started by administrator
EA16.txt,EA16.txt.precondition,The 'administrator has authenticated into the system
EA16.txt,EA16.txt.postcondition,The password is changed OR In the case where the administrator enters a password of less than characters or the old password is incorrect the system calls the use case Data Errati OR In case the service is not available the use case Service Not Available is called
EA16.txt,EA16.txt.quality_requirement,Not expected
EA16.txt,EA16.txt.flow_of_events.0,The administrator wants to change the password and presses the change password button
EA16.txt,EA16.txt.flow_of_events.1,The system displays the form for entering the old password
EA16.txt,EA16.txt.flow_of_events.2,The administrator enters the old password the new password and presses the confirm button
EA16.txt,EA16.txt.flow_of_events.3,The system notifies that the password has been changed
EA7.txt,EA7.txt.name,Entry Employee
EA7.txt,EA7.txt.actor,Started by administrator
EA7.txt,EA7.txt.precondition,The administrator has authenticated into the system
EA7.txt,EA7.txt.postcondition,The system registers the Employee OR In the case where the Administrator enters a serial number already in the system the system calls the use case Data Errati OR In the case where the service is not available the use case Service Not Available is called
EA7.txt,EA7.txt.quality_requirement,The name string may contain characters such as az AZ ' and must be less than in length and not empty The surname string can contain characters such as az AZ ' and must have length less than and not empty Email string consists of x xx and has a length less than characters Matriculation string contains only numeric characters is equal to characters The username string is not already in the system is well formed contains characters az AZ - and has length less than characters and is not empty Password string is well formed contains characters az AZ - and has length between and characters The password confirmation string must be consistent with the password entered
EA7.txt,EA7.txt.flow_of_events.0,The administrator logs into the system via administrative terminal and activates the procedure of Employee registration
EA7.txt,EA7.txt.flow_of_events.1,The system displays the form for entering a new employee
EA7.txt,EA7.txt.flow_of_events.2,The Administrator enters the Employee 's data and submits the registration request
EA7.txt,EA7.txt.flow_of_events.3,The system receives the form verifies that the registration number entered by the Administrator is not already in the system and generates a password saves the entered data and displays a notification of successful registration with the password assigned to the Employee
EA100.txt,EA100.txt.name,How To Become Volunteer
EA100.txt,EA100.txt.actor,Started by Citizen
