file,ID,text
EA58.txt,EA58.txt.flow_of_events.4,The user specifies the psycho-physical conditions of the recipient specifying the attached documents disability certificate issued by the ASL commission andor health card of the attending physician andor certificate of the pension provider ISEE model finally specifying a possible date of appointment with social workers
EA58.txt,EA58.txt.flow_of_events.5,Then submit the form
EA58.txt,EA58.txt.flow_of_events.6,The system picks up data regarding any social welfare services the recipient already uses
EA58.txt,EA58.txt.flow_of_events.7,It then forwards the request to the Social Services office and notifies the user that the request has been made
EA117.txt,EA117.txt.name,Volcanic
EA117.txt,EA117.txt.actor,Started by Citizen
EA117.txt,EA117.txt.precondition,The Citizen is authenticated in the municipal system OR The Citizen has accessed the municipal system
EA117.txt,EA117.txt.postcondition,The Citizen is satisfied with the information provided to himher OR The Citizen is unable to view the descriptive sheet of the Vulcan feature so the Service Not Available use case is extended which handles cases of technical failure
EA117.txt,EA117.txt.quality_requirement,System response time is in the hundredths of a second range if the Citizen correctly displays the card with inherent components The response time to the requested service changes if the Citizen fails to properly view the descriptive page
EA117.txt,EA117.txt.flow_of_events.0,The Citizen accesses this tab from the Risks use case if they want to know more about the volcanic situation in their municipality and the ability to view the Civil Defense monitoring methods
EA117.txt,EA117.txt.flow_of_events.1,The system responds with the correct display of a descriptive screen about the different types of eruptions of a volcano making available the possibility to view the current volcanic situation of the municipality
EA117.txt,EA117.txt.flow_of_events.2,The Citizen wants to know how the present volcanoes are monitored and therefore will invoke the use case Monitor Vulcanic
EA117.txt,EA117.txt.flow_of_events.3,The system provides the Citizen with a link to the Monitor Vulcanic use case so that they can learn about the actual situation
EA75.txt,EA75.txt.name,Information Museums
EA75.txt,EA75.txt.actor,Started by Citizen
EA75.txt,EA75.txt.precondition,The citizen has logged into the system
EA75.txt,EA75.txt.postcondition,The citizen has viewed the information about the museum OR In case the citizen wants to book the visit heshe will be referred to the museum website
EA75.txt,EA75.txt.quality_requirement,Not provided
EA75.txt,EA75.txt.flow_of_events.0,Citizen requests to view the list of museums
EA75.txt,EA75.txt.flow_of_events.1,The system allows the list of museums to be displayed
EA75.txt,EA75.txt.flow_of_events.2,The Citizen chooses the museum
EA75.txt,EA75.txt.flow_of_events.3,The system returns information regarding the chosen museum by displaying data such as - - - location opening dates and times link to the museum 's website
EA67.txt,EA67.txt.name,Edit Preservation Interview
EA67.txt,EA67.txt.actor,Started by Citizen
EA67.txt,EA67.txt.precondition,This extends the View Preservation Consultor io use case by considering the case when the citizen wants to change the chosen reservation
EA67.txt,EA67.txt.postcondition,The system has made the reservation change
EA67.txt,EA67.txt.quality_requirement,Not provided
EA67.txt,EA67.txt.flow_of_events.0,Citizen requests change of interview reservation in the counseling center
EA67.txt,EA67.txt.flow_of_events.1,The system displays a form for editing the reservation fields
EA67.txt,EA67.txt.flow_of_events.2,The citizen makes the changes in the form confirms the reservation
EA67.txt,EA67.txt.flow_of_events.3,Thesystemmodifiesthereservation
EA97.txt,EA97.txt.name,Tenders E Competitions
EA97.txt,EA97.txt.actor,Started by Citizen
EA97.txt,EA97.txt.precondition,The Citizen has authenticated himselfherself in the municipal system OR The Citizen has accessed the municipal system
EA97.txt,EA97.txt.postcondition,The Citizen has completed downloading the notice that is uniquely associated with the association for which they have chosen to participate OR The Citizen is unable to view the introductory screen with all associations and therefore the Service Not Available use case that handles technical failures will be extended
EA97.txt,EA97.txt.quality_requirement,The Citizen is able to view the page correctly meaning that the system response times are in the hundredths of a second range OR The Citizen fails to display the introductory screen correctly meaning that the system response time would be in the order of seconds ranging from a minimum of to a maximum of
EA97.txt,EA97.txt.flow_of_events.0,The Citizen accesses the initial screen in order to view the possibility of viewing the associations that support the Civil Defense
EA97.txt,EA97.txt.flow_of_events.1,The system responds to the need by allowing the Citizen to view all the associations that are part of the Civil Defense and that hire personnel with a small image of the association with next to it the possibility of receiving a download of the notice made available by the association in question
EA97.txt,EA97.txt.flow_of_events.2,The Citizen takes note of what the form provides and chooses from which among the associations made available to receive news for possible recruitment or participation in the competition about the modalities of the same
EA97.txt,EA97.txt.flow_of_events.3,The system responds to this by allowing himher to view the corresponding competition notice
EA44.txt,EA44.txt.name,View Practices Attended Employee
EA44.txt,EA44.txt.actor,Started by Employee
EA44.txt,EA44.txt.precondition,The Employee has logged in correctly
EA44.txt,EA44.txt.postcondition,The Employee selects a pending request and the use case Show Practice Awaiting Employee '' is invoked OR The Employee returns to the previous screen OR The System encountered an unanticipated error so calls the use case Service Not Available OR Unanticipated Quality Requirements
EA44.txt,EA44.txt.flow_of_events.0,Employee selects View Pending Requests ''
EA44.txt,EA44.txt.flow_of_events.1,System shows the list of pending files
EA65.txt,EA65.txt.name,Enrollment Card Youth
EA65.txt,EA65.txt.actor,Started by Citizen
EA65.txt,EA65.txt.precondition,This case requires that the citizen has gone through the authentication procedure
EA65.txt,EA65.txt.postcondition,The system has displayed the summary form OR In case an error occurred in the card application phase the system calls the use case Service Not Available OR Should the citizen enter incorrect data the system calls the use case Data Error OR In case the citizen decides to cancel the card request the system calls the use case Card Canceled
EA65.txt,EA65.txt.quality_requirement,Not provided
EA65.txt,EA65.txt.flow_of_events.0,Citizen applies for youth card enrollment
EA65.txt,EA65.txt.flow_of_events.1,The system displays a form for submitting the request
EA65.txt,EA65.txt.flow_of_events.2,The citizen enters the card application data into a form
EA65.txt,EA65.txt.flow_of_events.3,The system receives the form verifies the data and submits the request
EA65.txt,EA65.txt.flow_of_events.4,The system notifies that the card has been entered and displays the card number and the summary of data entered in a form
EA14.txt,EA14.txt.name,Edit E Mail Employee
EA14.txt,EA14.txt.actor,Started by employee
EA14.txt,EA14.txt.precondition,The 'employee has authenticated into the system
EA14.txt,EA14.txt.postcondition,The system saves the new e-mail The system detects an error and retrieves the use case Data Errati OR In the case where the service is not available the use case Service Not Available is invoked
EA14.txt,EA14.txt.quality_requirement,Not Provided
EA14.txt,EA14.txt.flow_of_events.0,The 'employee accesses the edit-email form
EA14.txt,EA14.txt.flow_of_events.1,The system shows the form the entry of the new e-mail
EA14.txt,EA14.txt.flow_of_events.2,The employee enters the new e-mail and presses the confirmation button
EA14.txt,EA14.txt.flow_of_events.3,The system updates the new e-mail
EA87.txt,EA87.txt.name,Request Copy File Construction
EA87.txt,EA87.txt.actor,Initiated by citizen communicates with clerk
EA87.txt,EA87.txt.precondition,Includes Search File Building
EA87.txt,EA87.txt.postcondition,The system proceeds to send the request to the clerk The system notifies the citizen that the request has been submitted and the copy will be sent to them shortly OR in the case of technical failures the system invokes the use case Service Not Available
EA87.txt,EA87.txt.quality_requirement,Not available
EA87.txt,EA87.txt.flow_of_events.0,Citizen requests copy of file using appropriate button
EA87.txt,EA87.txt.flow_of_events.1,The system sends the request to the clerk
EA87.txt,EA87.txt.flow_of_events.2,The system notifies the citizen that the request has been forwarded and the copy will be sent shortly
EA91.txt,EA91.txt.name,Issue Certificates
EA91.txt,EA91.txt.actor,Initiated by citizen communicates with employee
EA91.txt,EA91.txt.precondition,The citizen has authenticated in the system
EA91.txt,EA91.txt.postcondition,The system displays the form for printing The system sends a message notifying the relevant clerk of the request OR in the case of incorrect data entry the system invokes the use case Dati Errati OR in the case of technical failures the system invokes the use case Service Not Available
EA91.txt,EA91.txt.quality_requirement,Not Available
EA91.txt,EA91.txt.flow_of_events.0,Citizen accesses the certificate and permit issuance area using the appropriate link
EA91.txt,EA91.txt.flow_of_events.1,The system displays the form for entering the data necessary for the issuance of the certificate eg
EA91.txt,EA91.txt.flow_of_events.2,certificate of fitness certificate of habitability
EA91.txt,EA91.txt.flow_of_events.3,The citizen enters the required data
EA91.txt,EA91.txt.flow_of_events.4,The system verifies the correctness and completeness of the data then displays a summary screen or activates the Dati Errati use case
EA91.txt,EA91.txt.flow_of_events.5,The citizen confirms the operation
EA91.txt,EA91.txt.flow_of_events.6,The system displays the form for printing
EA91.txt,EA91.txt.flow_of_events.7,The system sends a message notifying the appropriate employee of the request
EA91.txt,EA91.txt.flow_of_events.8,The citizen makes the printout to be handed in at the municipal office with the revenue stamp
EA64.txt,EA64.txt.name,Information Informagiovani
EA64.txt,EA64.txt.actor,Started by Citizen
EA64.txt,EA64.txt.precondition,The citizen has logged into the system
EA64.txt,EA64.txt.postcondition,The citizen has viewed the information about the initiatives OR In case of failure the system calls Service Not Available
EA64.txt,EA64.txt.quality_requirement,Not expected
EA64.txt,EA64.txt.flow_of_events.0,Citizen requests viewing of informagiovani news list
EA64.txt,EA64.txt.flow_of_events.1,The system allows to view the list of information regarding - special official employment gazette - local competition notices information - study trips
EA64.txt,EA64.txt.flow_of_events.2,The citizen selects the desired information
EA64.txt,EA64.txt.flow_of_events.3,The system returns the information concerning the news specifying - date of publication of the notice - expiration date of the notice - description
EA123.txt,EA123.txt.name,IRPEF
EA123.txt,EA123.txt.actor,Initiated by Citizen
EA123.txt,EA123.txt.precondition,The Citizen has authenticated in the system
EA123.txt,EA123.txt.postcondition,The payment has been made OR In the case where there is insufficient funds to cover the payment or an error occurs in the transaction the System calls the case use case Payment Not Successful OR In the case where additional generic problems arise the System calls the use case Service Not Available
EA123.txt,EA123.txt.quality_requirement,Not Provided
EA123.txt,EA123.txt.flow_of_events.0,The Citizen clicks on the button to access the Online Tax Payment area
EA123.txt,EA123.txt.flow_of_events.1,The System displays the list of fees that can be paid online
EA123.txt,EA123.txt.flow_of_events.2,The Citizen selects the section dedicated to Income Tax for Individuals and its payment
EA123.txt,EA123.txt.flow_of_events.3,The System redirects the Citizen to the necessary section showing the form of the relevant tax and the relevant amount to be paid
EA123.txt,EA123.txt.flow_of_events.4,The Citizen confirms the correctness of the information selects the preferred payment method and initiates the transaction
EA123.txt,EA123.txt.flow_of_events.5,The System performs the transaction and displays a successful payment message
EA115.txt,EA115.txt.name,View Results Toxicological Environmental
EA115.txt,EA115.txt.actor,Citizen User Registered
EA115.txt,EA115.txt.precondition,The Citizen is authenticated in the municipal system OR The Citizen has accessed the municipal system
EA115.txt,EA115.txt.postcondition,The Citizen is satisfied with the information collected OR The Citizen is unable to view the card and therefore the use case Service Not Available which handles technical failure cases is extended
EA115.txt,EA115.txt.quality_requirement,System response times are acceptable and on the order of hundredths of a second if the card is correctly displayed by the person who requested it Whereas if there was some hiccup in the display of the use case the system response times increase on the order of seconds from a minimum of to a maximum of
EA115.txt,EA115.txt.flow_of_events.0,The Citizen accesses this tab in order to become personally aware of the environmental situation in the municipality where he or she resides whether it is being kept under control and what values are at risk and why this is so
EA115.txt,EA115.txt.flow_of_events.1,The system responds with a descriptive screen about the toxicological values received from the chemical and toxicological analyses carried out by the Civil Defense on the environment and municipal land
EA70.txt,EA70.txt.name,Reservation Interview Canceled
EA70.txt,EA70.txt.actor,Started by Citizen
EA70.txt,EA70.txt.precondition,This use case extends Booking Interview and checks when a citizen decides to cancel the interview booking
EA70.txt,EA70.txt.postcondition,The system resubmits the form
EA70.txt,EA70.txt.quality_requirement,Not provided
EA70.txt,EA70.txt.flow_of_events.0,Citizen decides heshe wants to cancel the interview reservation and then enters in the form that heshe wants to cancel it
EA70.txt,EA70.txt.flow_of_events.1,System receives the form notifies cancellation of interview booking and resubmits the form
EA8.txt,EA8.txt.name,Logout Administrator
EA8.txt,EA8.txt.actor,Started by Administrator
EA8.txt,EA8.txt.precondition,The administrator has logged into the system Logout condition The system closes the administrator 's session
EA8.txt,EA8.txt.quality_requirement,Not provided
EA8.txt,EA8.txt.flow_of_events.0,The administrator wants to end the work session and clicks on the Logout button
EA8.txt,EA8.txt.flow_of_events.1,The system logs the administrator out of the system and returns to the main screen
EA63.txt,EA63.txt.name,Information Consultancy Youth
EA63.txt,EA63.txt.actor,Started by Citizen
EA63.txt,EA63.txt.precondition,The citizen has logged into the system
EA63.txt,EA63.txt.postcondition,The citizen has viewed the information about consulting room OR In case the citizen wants to book an interview the system calls the use case Booking Interview
EA63.txt,EA63.txt.quality_requirement,Not provided
EA63.txt,EA63.txt.flow_of_events.0,The Citizen requests to view the list of counseling centers
EA63.txt,EA63.txt.flow_of_events.1,The system allows to view the list of consulting rooms
EA63.txt,EA63.txt.flow_of_events.2,The Citizen chooses the consulting room
EA63.txt,EA63.txt.flow_of_events.3,The system returns information regarding the chosen consultatory displaying data such as - its location - its opening dates and times
EA63.txt,EA63.txt.flow_of_events.4,- the list of interviews if any booked invoking the use case View Consulting Reservation
EA102.txt,EA102.txt.name,Download Subscription
EA102.txt,EA102.txt.actor,Started by Citizen
EA102.txt,EA102.txt.precondition,The Citizen has authenticated in the system OR The Citizen has accessed the municipal system
EA102.txt,EA102.txt.postcondition,The Citizen has completed downloading the form that heshe must complete and submit in person as it requires accompanying external forms and the use case Civil Service is invoked The Citizen fails to view the download of the form and therefore the use case Service Not Available which handles technical failure cases is extended
EA102.txt,EA102.txt.quality_requirement,The system response time to load the form download ranges from to seconds OR System response time ranges from to seconds if the module download fails
EA102.txt,EA102.txt.flow_of_events.0,The Citizen accesses this screen because heshe wants to enroll in Civil Service
EA102.txt,EA102.txt.flow_of_events.1,The system responds with a page where the requesting Citizen can download the form to fill out and submit to the Civil Defense office
EA109.txt,EA109.txt.name,Civil Protection
EA109.txt,EA109.txt.actor,Started by Citizen
EA109.txt,EA109.txt.precondition,The Citizen is authenticated in the system OR The Citizen has accessed the municipal system
EA109.txt,EA109.txt.postcondition,The system makes the description sheet available to the Citizen and heshe acknowledges it OR In the event that the system fails to have the card displayed the use case Service Not Available is extended which handles Technical Failure cases
EA109.txt,EA109.txt.quality_requirement,The response time to the Citizen 's need is in the hundredths of a second range if the Citizen correctly displays the screen Response times vary in the order of seconds from a minimum of to a maximum of if the Citizen does not correctly view the descriptive screen
EA109.txt,EA109.txt.flow_of_events.0,Citizen accesses the descriptive sheet about general information about the municipal body in question
EA109.txt,EA109.txt.flow_of_events.1,The system responds to the information functionality allowing the display of a description about the active roles played by the Civil Defense
EA12.txt,EA12.txt.name,Edit E Mail Administrator
EA12.txt,EA12.txt.actor,Started by administrator
EA12.txt,EA12.txt.precondition,The administrator has authenticated into the system
EA12.txt,EA12.txt.postcondition,The system saves the new e-mail The system detects an error and retrieves the use case Data Errati OR In the case where the service is not available the use case Service Not Available is invoked
EA12.txt,EA12.txt.quality_requirement,Not Provided
EA12.txt,EA12.txt.flow_of_events.0,Administrator accesses the email edit form
EA12.txt,EA12.txt.flow_of_events.1,The system shows the form the new e-mail entry
EA12.txt,EA12.txt.flow_of_events.2,The administrator enters the new e-mail and presses the confirmation button
EA12.txt,EA12.txt.flow_of_events.3,The system updates the new email
EA125.txt,EA125.txt.name,Payment Fees
EA125.txt,EA125.txt.actor,Started by Citizen
EA125.txt,EA125.txt.precondition,The Citizen has authenticated in the system
EA125.txt,EA125.txt.postcondition,The payment has been made OR In case there is an error in data entry or the available funds are not sufficient to cover the payment the System calls the use case Payment Not Received OR The Citizen clicks on the button related to dispute a particular fine in which case the System calls the use case Contesta Multa OR In the case where there are errors in the data entered by the Citizen the System calls the use case Dati Errati OR In the case where there are generic errors the system calls the use case Service Not Available
EA125.txt,EA125.txt.quality_requirement,None
EA125.txt,EA125.txt.flow_of_events.0,The Citizen clicks on the button to access the online fines management feature
EA125.txt,EA125.txt.flow_of_events.1,The System redirects the Citizen to the desired section
EA125.txt,EA125.txt.flow_of_events.2,The Citizen clicks on the button to pay fines online
EA125.txt,EA125.txt.flow_of_events.3,The System searches for fines against the Citizen in the database for which payment has not yet been received
EA125.txt,EA125.txt.flow_of_events.4,The Citizen selects the fine for which heshe wishes to make payment
EA125.txt,EA125.txt.flow_of_events.5,The System displays the fine form and the relevant amount to be paid
EA125.txt,EA125.txt.flow_of_events.6,The Citizen verifies that the information is correct and initiates the transaction selecting the preferred payment method
EA125.txt,EA125.txt.flow_of_events.7,The System performs the transaction and displays a successful payment message
EA138.txt,EA138.txt.name,Data Errati
EA138.txt,EA138.txt.actor,Started by Citizen
EA138.txt,EA138.txt.precondition,This use case extends use cases and handles exceptional cases of failure due to incorrect input
EA138.txt,EA138.txt.postcondition,The input form is resubmitted
EA138.txt,EA138.txt.quality_requirement,Not expected
EA138.txt,EA138.txt.flow_of_events.0,System displays a message to the terminal screen indicating that the request entered was incorrect
EA138.txt,EA138.txt.flow_of_events.1,Citizen reads the notification message
EA138.txt,EA138.txt.flow_of_events.2,System resubmits the input form
EA73.txt,EA73.txt.name,Information Libraries
EA73.txt,EA73.txt.actor,Started by Citizen
EA73.txt,EA73.txt.precondition,The citizen has logged into the system
EA73.txt,EA73.txt.postcondition,The citizen has viewed the library information OR In case the citizen wants to view a book heshe will be referred to the library website
EA73.txt,EA73.txt.quality_requirement,Not provided
EA73.txt,EA73.txt.flow_of_events.0,Citizen requests to view list of libraries
EA73.txt,EA73.txt.flow_of_events.1,The system allows to view the list of libraries
EA73.txt,EA73.txt.flow_of_events.2,The Citizen chooses the library
EA73.txt,EA73.txt.flow_of_events.3,The system returns information concerning the chosen library by displaying data such as - - - location opening dates and times and link to the library 's website
EA130.txt,EA130.txt.name,Request IPPA Rifiied
EA130.txt,EA130.txt.actor,Started by Employee
EA130.txt,EA130.txt.precondition,The Clerk has authenticated in the system Request IPPA Rifiied includes the case of use Request IPPA
EA130.txt,EA130.txt.postcondition,The system notifies the citizen of the outcome
EA130.txt,EA130.txt.quality_requirement,Not expected
EA130.txt,EA130.txt.flow_of_events.0,The Employee displays the notification received
EA130.txt,EA130.txt.flow_of_events.1,The System displays to the Clerk the request made by the citizen
EA130.txt,EA130.txt.flow_of_events.2,The Clerk reveals an error in the request and rejects the procedure the request
EA130.txt,EA130.txt.flow_of_events.3,The System sends a notification to the citizen who requested the service
EA66.txt,EA66.txt.name,Registration News Informagiovani
EA66.txt,EA66.txt.actor,Started by Citizen
EA66.txt,EA66.txt.precondition,This case requires that the citizen has gone through the authentication procedure
EA66.txt,EA66.txt.postcondition,The system has submitted the applicant 's request OR Should an error occur at the news request stage the system calls the use case Service Not Available OR Should the citizen decide to cancel the news request the system calls the use case News Annulled
EA66.txt,EA66.txt.quality_requirement,Not Provided
EA66.txt,EA66.txt.flow_of_events.0,Citizen requests subscription to informagiovani news to receive service-related advertisements
EA66.txt,EA66.txt.flow_of_events.1,The system displays a form for submitting the request
EA66.txt,EA66.txt.flow_of_events.2,The citizen enters the news request data into a form
EA66.txt,EA66.txt.flow_of_events.3,The system receives the form verifies the data and submits the request
EA40.txt,EA40.txt.name,Request Electrical Case
EA40.txt,EA40.txt.actor,Started by Citizen continued by employee
EA40.txt,EA40.txt.precondition,The Citizen must be authenticated in the system The voter card has not been sent
EA40.txt,EA40.txt.postcondition,The System alerts the clerk OR In the case where the service is not available the case is invoked of use Service Not Available
EA40.txt,EA40.txt.quality_requirement,Not Provided
EA40.txt,EA40.txt.flow_of_events.0,The Citizen presses on the Electoral Card button
EA40.txt,EA40.txt.flow_of_events.1,The system displays the card request form
EA40.txt,EA40.txt.flow_of_events.2,The Citizen confirms the operation
EA40.txt,EA40.txt.flow_of_events.3,The system sends a notification to the clerk
EA40.txt,EA40.txt.flow_of_events.4,The citizen will receive the election card which Will be delivered to hisher home address
EA15.txt,EA15.txt.name,Edit Employee
EA15.txt,EA15.txt.actor,Started by administrator
EA15.txt,EA15.txt.precondition,The administrator has authenticated into the system This use case includes Search Employee and occurs when the administrator wants to edit an employee
EA15.txt,EA15.txt.postcondition,The system modifies the 'employee OR In the case where the service is not available the use case is invoked of use Service Not Available
EA15.txt,EA15.txt.quality_requirement,Not Provided
EA15.txt,EA15.txt.flow_of_events.0,The administrator presses the edit-employee button
EA15.txt,EA15.txt.flow_of_events.1,The system displays a form for editing the clerk
EA15.txt,EA15.txt.flow_of_events.2,The administrator enters the data
EA15.txt,EA15.txt.flow_of_events.3,The system saves the changes made
EA21.txt,EA21.txt.name,Recovery Password Employee
EA21.txt,EA21.txt.actor,Started by employee
EA21.txt,EA21.txt.precondition,The employee has authenticated into the system
